Common European Adder,Animalia,Chordata,Reptilia,Squamata,Viperidae,Vipera,V. berus,Asia,"Small mammals, lizards, amphibians, and sometimes bird eggs.",,Solitary,,Predators during its hibernation,"Dark zigzag pattern down the length of the back, and V or X shaped marking on their head.","Common European viper, European viper, adder, common adder, common viper, crossed viper, European adder, European common viper, northern viper, cross adder, hogorm, hoggorm, kyykäärme, hugorm",,"Forest edges, countryside, river banks",Carnivore,,Diurnalor Nocturnal Depending on Region and Seasonterrestrial,"Common adder, black adder, European adder",,,,,BrownGreyBlackTanBlack-Brown,Scales,,10-15 years,,24-36 inches,,,Mar-20,"Birds of prey, carnivorous mammals",,,,Timid,,Eurasia,Europe,,,,,,Yes,Low,"Small mammals such as mice, shrews, and rats.",,,,,,,,,,,,,,,,
Common Frog,Animalia,Chordata,Amphibia,Anura,Ranidae,Rana,Rana temporaria,Europe,,,,,,,,,"Forests, rivers and marshes",Carnivore,,Solitary,,,,Found throughout the European continent!,,BrownGreyBlackGreen,Permeable,5 mph,5 - 10 years,20g - 80g (0.7oz - 2.8oz),6cm - 10cm (2.4in - 4in),,,,,Amphibian,,Short back legs and webbed toes,,,,,,,,,1500,,,"Insects, Worms, Snails",,,,,,Insects,,,,,,,,,,
Common Furniture Beetle,Animalia,Arthropoda,Insecta,Coleoptera,Ptinidae,Anobium,Anobium punctatum,Africa,,Larvae,Solitary,Unknown,,The small grooves on the shell covering,Common horse borer and woodworm,3-5 weeks,Anywhere with sufficient amounts of wood,Herbivore,,,Common Furniture Beetle,1,Worldwide,,,Dark BrownTawny,Exoskeleton,,3-5 years,1-10mg,7mm (0.25in),3-5 years,,20-100 eggs,"Birds, mammals, and other animals",Insect,,,,,Asia,Central-America,Eurasia,,,,,,,,,,,,,Wood,,Europe,,,North-America,Oceania,South-America,,,
Common House Spider,Animalia,Arthropoda,Arachnida,Araneae,Theridiidae,Parasteatoda,Parasteatoda tepidariorum,Africa,"Mosquitoes, flies, ants",Spiderling,Solitary,,"Loss of habitat, pesticides",Eight spindly legs,House spider,30-50 days,The corners of a room,Carnivore,,,House spider,,Worldwide,,Solitary,BrownBlackTan,Exoskeleton,1 mph,1 year,Less than 1 ounce,0.15in - 0.24in,,,400+ eggs,"Birds, cats, dogs, wasps",Insect,,,,,Asia,Central-America,Eurasia,,,,,,,,,,,,,,,Europe,,,North-America,Oceania,South-America,,,
Common Loon,Animalia,Chordata,Aves,Gaviiformes,Gaviidae,Gavia,Gavia Immer,Europe,,,,,,,,,Freshwater lakes in cooler climates,Omnivore,,Flock,,,,Also known as the Great Northern Diver,,BrownGreyBlackWhite,Feathers,,15 - 25 years,3kg - 5kg (6.6lbs - 11lbs),63cm - 81cm (24.8in - 31.8in),,,,"Human, Eagles, Osprey",Bird,,"Large body size and eerie, yodel-like call",,,North-America,,,100cm - 136cm (39in - 53.5in),,,2,,,"Fish, Frogs, Insects",,,,,,Fish,,,,,,,,,,
Common Raven,Animalia,Chordata,Aves,Passeriformes,Corvidae,Corvus,Corvus corax,Africa,"Insects, small mammals, reptiles, amphibians, spiders, eggs",,Flocks,16 million,Humans,Their intelligence,"Corby, corbeau, western raven, northern raven",,"Open areas such as tundras, taigas, cliffs, deserts, plains, but can be found in just about every habitat save rainforests",Omnivore,,,Raven,,"Most countries in the northern hemisphere, including most of North America, southern Greenland, north Africa, most of Europe, Russia and China",,,Black,Feathers,40 mph,13 to 44 years,1.5 to 3.6 pounds,25 inches,,,Three to seven,"Owls, eagles, martens attack their eggs, larger birds of prey such as great horned owls and mammalian carnivores such as coyotes or cougars might prey on younger ravens.",Bird,,,,,Asia,Central-America,Eurasia,45 to 51 inches,18 to 25 days,,1,,,,,,,"Old trees, ledges, cliffs, even utility poles",35 to 42 days,,,Europe,,,North-America,,,,,
Common Toad,Animalia,Chordata,Amphibia,Anura,Bufonidae,Bufo,Bufo Bufo,Europe,,,,,,,,,"Forests, woodlands and marshes",Carnivore,,Solitary,,,,Most active in wet weather!,,BrownGreyYellowBlackGreen,Permeable,5 mph,2 - 4 years,20g - 80g (0.7oz - 2.8oz),10cm - 18cm (4in - 7in),,,,"Foxes, Grass Snakes, Hedgehogs",Amphibian,,"Rough skin and long, agile toes",,,,,,,,,100,,,"Insects, Worms, Spiders",,,,,,Insects,,,,,,,,,,
Conger Eel,Animalia,Chordata,Actinopterygii,Anguilliformes,Congridae,Conger,,Ocean,"Crustaceans, small fish",,,,,"Long, thin body and snout","poison eel, conger, dog eel, southern conger, grey eel",,oceanic,Carnivore,,,conger eel,14,,,,BrownGreyBlackWhite,Smooth,,20 years,"10 - 160 lbs average, 350 lbs largest","5 - 6 feet average, 9.8 feet largest",,,,,,,,,,,,,,,,,,,,Salt,,,,,,,,,,,,,,,
Congo Snake,Animalia,Chordata,Amphibia,Urodela,Amphiumidae,Amphiuma,,Central-America,"Crayfish, insects, worms, snails, fish, reptiles, and amphibians",,,,,,,,,Carnivore,30-350 eggs,,"Congo snake, amphiuma, or Congo eel",,,,,GreyBlackPurple,,,Up to 27 years,,Up to 4 feet,,,,,,,,,,North-America,,,,,,,No,Low,,,,,,,,,,,,,,,,,
Cookiecutter Shark,Animalia,Chordata,Chondrichthyes,Squaliformes,Dalatiidae,Isistius,,Ocean,"large squid, gonostomatids, crustaceans",,Solitary,Unknown,Ocean pollution,Cookiecutter sharks glow,Cigar shark,,Ocean,Carnivore,,,Cigar shark,2,,,,Brown,Rough,,Up to 25 years,,14-22 inches,,,,large sharks and bony fish,Dalatiidae,,,,,,,,,,,,,,,Salt,,,,,"Marlin, tuna, other sharks, stingrays, seals and whales",,,,,,,,,,
Cooper’s Hawk,Animalia,Hemichordata,Aves,Accipitriformes,Accipitridae,Accipiter,Accipiter cooperii,Central-America,"Birds, mammals",Chicks,Solitary,"100,000-1,000,000",Habitat loss,Long tail and rounded wingtips,"Chicken hawk, flying cross, striker",,"Woodlands, forests",Carnivore,,,Cooper's hawk,,North America,,Pairs,BrownGreyWhite,Feathers,,12 years,0.45kg-0.7kg (1lbs-1.5lbs),0.35m-0.46m (1.1ft-1.5ft),2 years,1 month,03-May,,Hawk,,,,,North-America,,,,35 Days,,,,,,,,,,,,,,,,,,,,,
Copperhead,Animalia,Chordata,Reptilia,Squamata,Viperidae,Agkistrodon,Agkistrodon contortrix,Central-America,"Insects, lizards, mice, voles, shrews, snakes, small turtles, salamanders, frogs, small birds, baby squirrels, rabbits and opossums, chipmunks, bats, moles, carrion",,,,,,,,,Carnivore,,,"Copperhead, rattlesnake pilot, thunder snake, moccasin, highland or dry-land moccasin",,,,,TanDark BrownPinkLight-Brown,Scales,,Lifespan of 15 to 29 years,,,,,One to 21,,,,,,,North-America,,,,,,,,,,,,,,,,,,,,,,,,,
Coral,Animalia,Cnidaria,Anthozoa,,,,,Ocean,,,,,,,,,Tropical Oceans,Omnivore,"1,000s",,Coral,,Tropical Oceans,,,YellowRedBlueWhiteGreenOrangePurplePinkGoldenLight-Brown,Porous,,15 - 30 years,,,,,,"fish, barnacles, snails, crabs, starfish, marine worms and other sea creatures",,,Variety of colours and full of holes for species to hind in,,,,,,,,,,,,zooplankton,,,,,,Plankton,,,,,,,,,,
Coral Snake,Animalia,Chordata,Reptilia,Squamata,Elapidae,Various,Various,Asia,"Mainly other snakes, but also small mammals.",Hatchling,Solitary,,Human encroachment,,,,"Forests, jungles, some aquatic",Carnivore,,Nocturnal,coral snake,78,,,,YellowRedBlueBlackWhite,Scales,,,,"Most are 2-3 feet long, but a few species reach almost 6 feet.",,,02-Jul,,,,,,,Central-America,North-America,Oceania,,,,,,,,,,,,,,,South-America,,,,,,,,
Corgidor,Animalia,Chordata,Mammalia,Carnivora,Canidae,Canis,Canis lupus,North-America,,,,,,,,,,Omnivore,,,,,,,,,,,,,,,,,,,,,,,,,,,,,,,,,,,,,,,,,,,,,,,,
Corgipoo,Animalia,Chordata,Mammalia,,,,,North-America,,,,,,,,,,Omnivore,,,,,,,,,,,,,,,,,,,,,,,,,,,,,,,,,,,,,,,,,,,,,,,,
Corkie,Animalia,Chordata,Mammalia,Carnivora,Canidae,Canis,Canis lupus,North-America,,,,,,,,,,Omnivore,,,,,,,,FawnRedBlueMulti-colored,Hair,,11 to 15 years,20 lbs,,,,,,,,,"Friendly, intelligent, and sensitive",,,,,,,,,,,,,,,,,,,,,,,,,,,
Corman Shepherd,Animalia,Chordata,Mammalia,Carnivora,Canidae,Canis,Canis lupus,North-America,,,,,,,,,,Omnivore,,,,,,,,BrownBlackWhiteCream,Hair,,10-15 years,70 lbs,,,,,,,,,"Active, energetic, and great watchdogs",,,,,,,,,,,,,,,,,,,,,,,,,,,
Corn Rex Cat (Cornish Rex),Animalia,Chordata,Mammalia,Carnivora,Felidae,Felis,Felis catus,Europe,,,,,,,,,,Omnivore,,,Corn Rex,,,,,BrownRedBlueBlackWhiteCreamSilver,,,11-20 years,5-10 pounds,,,,,,,,,,,,,,,,,,,,,,,,,,,,,,,,,,,,
Corn Snake,Animalia,Chordata,Reptilia,Squamata,Colubridae,Pantherophis,P. guttatus,North-America,"Rats, mice, baby birds, eggs",Hatchling,Solitary,,,"Shield pattern on their back, and","Red cornsnake, chicken snake, red rat snake, eastern corn snake.",,"Forested areas, fields, swamps, hardwood hammocks, neighborhoods bordering habitat.",Carnivore,,Diurnalor Nocturnal Depending on Region and Season,"Corn snake, red rat snake, eastern red rat snake, Slowinski's rat snake, .",2,,,,BrownGreyRedBeigeLight-Brown,Scales,,"15 years in captivity, less in the wild",,,,,Oct-30,"Birds of prey, other carnivores, some snakes, coyotes, cats.",,,,Relatively docile,,,,,,,,,,,Rats and mice,,,,,,Rats and mice,,,,,,,,,,
Coton de Tulear,Animalia,Chordata,Mammalia,Carnivora,Canidae,Canis,Canis lupus,Africa,,Puppy,,,,,,,,Omnivore,,,,,,,,GreyBlackWhite,Hair,,,,,,,2-5 puppies,,Mammal,,The breeds coat.,,,,,,,,,,,,,,,,,,,Madagascar,,,,,,,,,
Cotton-top Tamarin,Animalia,Chordata,Mammalia,Primates,Callitrichidae,Saguinus,Saguinus Oedipus,South-America,,,,,,,,,Lowland tropical forest,Omnivore,2,Troop,,,,Found in tropical forest edges!,,BrownBlackWhiteTan,Fur,24 mph,8 - 15 years,220g - 900g (7.7oz - 32oz),18cm - 30cm (7in - 12in),,,,"Snakes, birds of prey, jaguars",Mammal,,"Small body size and long, thin tail",,,,,,,,,,,,"Fruit, Insects, Rodents",,,,,,Fruit,,,,,,,,,,
Cottonmouth,Animalia,Chordata,Reptilia,Squamata,Viperidae,Agkistrodon,Agkistrodon piscivorus,North-America,"Fish, rodents, shrews, frogs, reptiles, birds, insects, and eggs",,,,,,,,,Carnivore,,,Cottonmouth,,,,,BrownBlackOlive,Scales,,15-20 years,,2-6 feet,,,Up to 16 live young,,,,,,,,,,,,,,,,,,,,,,,,,,,,,,,,
Cougar,Animalia,Chordata,Mammalia,Carnivora,Felidae,Puma,Felis Concolor,North-America,,,,,,,,,Forest and mountainous regions,Carnivore,3,Solitary,,,,Largest feline in North America,,BrownBlackTan,Fur,30 mph,10 - 20 years,29kg - 90kg (64lbs - 198lbs),1.5m - 2.75m (5ft - 9ft),,,,,Mammal,,Powerful forearms and paws and muscular jaw,,,,,,,,,,,,"Deer, Elk, Beavers",,,,,,Deer,,,,,,,,,,
Cow,Animalia,Chordata,Mammalia,Artiodactyla,Bovidae,Bos,Bos Taurus,Africa,,,,,,,,,Forest and grassland,Herbivore,1,Herd,,,,There are nearly 1.5 million worldwide!,,BrownBlackWhite,Leather,25 mph,12 - 20 years,"400kg - 800kg (881lbs - 1,760lbs)",1.5m - 1.8m (5ft - 6ft),,,,"Human, Bears, Wolves",Mammal,,Thick leathery skin and complex digestive system,,,Asia,Central-America,Eurasia,,,,,,,"Grass, Seeds, Flowers",,,,,,Grass,,Europe,,,North-America,Oceania,South-America,,,
Coyote,Animalia,Chordata,Mammalia,Carnivora,Canidae,Canis,Canis latrans,Central-America,,,,,,,,,"Forests, plains and deserts",Carnivore,6,Pack,,,,Also known as the Prairie Wolf!,,BrownGreyTan,Fur,40 mph,10 - 15 years,7kg - 21kg (15lbs - 46lbs),75cm - 90cm (30in - 35in),,,,"Human, Bears, Wolves",Mammal,,"Pointed ears and nose and a long, bushy tail",,,North-America,,,,,,,,,"Rabbit, Mice, Deer",,,,,,Rabbit,,,,,,,,,,
Crab,Animalia,Arthropoda,Malacostraca,Decapoda,Brachyura,,Brachyura,Africa,,,,,,,,,Coral reefs and coastline,Carnivore,2,Solitary,,,,There are 93 different crab groups,,BrownRedBlueOrange,Shell,12 mph,1 - 100 years,"100g - 2,000g (3.5oz - 704oz)",1cm - 400cm (0.4in - 157in),,,,,Arthropod,,"Hard, armoured shell and eight legs",,,Asia,Central-America,Eurasia,,,,,,,"Shrimp, Fish, Mussels",,,,,,Shrimp,,Europe,,,North-America,Ocean,Oceania,,South-America,
Crab Spider,Animalia,Arthropoda,Arachnida,Araneae,Thomisidae,,,Africa,"Other insects, flowers, pollen",,,,Parasites and other insects,,,3.5 weeks,"Gardens, meadows, woodlands, tropical rainforests, grasslands, marshes and scrublands",Omnivore,,Diurnal,,2100,,,,BrownYellowBlueBlackWhiteGreenPink,Exoskeleton,,,,0.16 to 12 inches,,,"2-1,000","Wasps, ants, large spiders, lizards, birds and shrews.",,,Crablike appearance,,,Asia,Central-America,Eurasia,,,,,,,,,,,,,,,Europe,,,North-America,Oceania,South-America,,,
Crab-Eating Macaque,Animalia,Chordata,Mammalia,Primates,Cercopithecidae,Macaca,Macaca Fascicularis,Asia,,,,,,,,,Rainforest and tropical jungle,Carnivore,1,Troop,,,,Found throughout the South-East Asian jungles!,,BrownGreyYellowWhite,Fur,30 mph,15 - 30 years,3kg - 9kg (7lbs - 20lbs),,,,,"Eagle, Tiger, Large reptiles",Mammal,38cm - 55cm (15in - 22in),Very sociable animal with a long tail,,,,,,,,,,,,"Crabs, Fruits, Seeds, Insects",,,,,,Crabs,,,,,,,,,,
Crabeater Seal,Animalia,Chordata,Mammalia,Carnivora,Pinnipedia,Lobodon,Lobodon carcinophaga,Antarctica,Krill,Pups,Solitary,7 to 70 million,Cimate change,"The irregular, jagged teeth",Krill-eating seal,11 months,Ice packs and shallow water,Carnivore,,,Crabeater seal,1,Antarctica,,Solitary,BrownGreyWhite,Hair,15 mph,40 years,Up to 600 pounds,6.6-8.2 feet,3-4 years,3 weeks,1 pup,Killer whales and leopard seals,Mammal,1-2 feet,,,,,,,,,,,,,,,,,,,,,,,,,,,,,
Crane,Animalia,Chordata,Aves,Gruiformes,Gruidae,,Gruidae,Africa,,,,,,,,,Temperate wetlands,Omnivore,,Flock,,,,Many are critically endangered species!,,BrownGreyRedBlueBlackWhite,Feathers,25 mph,15 - 30 years,3.7kg - 10kg (8.2lbs - 22lbs),1m - 1.4m (40in - 55in),,,,"Fox, Eagle, Wildcats",Bird,,Large body size and long beak,,,Asia,Eurasia,Europe,1.8m - 2.4m (71in - 95in),,,4,,,"Insects. Fish, Grain",,,,,,Insects,,North-America,,,Oceania,,,,,
Crappie Fish,Animalia,Chordata,Actinopterygii,Perciformes,Centrarchidae,Pomoxis,,Ocean,"Zooplankton, insect, crustaceans, and fish.",,School,Unknown.,Fishing.,The speckled body.,"White perch, paper mouths, strawberry bass, and more.",2-3 days.,"Rivers, ponds, pools, and lakes.",Omnivore,,,,2,,,,BlackWhiteGreenSilver,Scales,,,,,,,,,Ray-finned fish.,,,,,,,,,,,,,,,Fresh,,,,,,,,,6-7.5,,,,,,
Crested Gecko,Animalia,Chordata,Reptilia,Squamata,Diplodactglidae,Correlophus,Correlophus ciliatus,Oceania,"Insects, arthropods such as spiders",hatchling,Solitary,,"Habitat destruction, introduction of invasive species.",The fringed crests that shade their eyes and run down the back and over the legs,"New Caledonian crested gecko, eyelash gecko",90 to 190 days,Rainforest from 492 to 3281 feet,Omnivore,,,crested gecko,1,New Caledonia,,solitary,YellowRedTanOrangePeach,Scales,30 mph,10 to 20 years in captivity,1.06 to 1.23 ounces,six to 10 inches,nine months to one year,,two,"Fire ants, dogs, cats, snakes, rats, other geckos",reptile,,,,,,,,,,,,,,,,,,,,,,,,,,,,,,
Crested Penguin,Animalia,Chordata,Aves,Sphenisciformes,Spheniscidae,Eudyptes,Eudyptes robustus,Ocean,,,,,,,,,Rocky Antarctic Islands,Carnivore,2,Colony,,,,Has long yellow eyebrows!,,GreyYellowBlackWhite,Feathers,,15 - 20 years,3kg - 6kg (6.6lbs - 13lbs),,,,,"Leopard Seal, Killer Whale, Sharks",Bird,60cm - 68cm (24in - 27in),Red beak and bright yellow eyebrows,,,Oceania,,,,,,,,,"Krill, Fish, Shrimp",,,,,,Krill,,,,,,,,,,
Cricket,Animalia,Arthropoda,Insecta,Orthoptera,Gryllidae,Acheta,Acheta domesticus,Africa,"Fruit, leaves, grasses, flowers, seeds, and other insects",Nymphs,Solitary,,,The long legs,,One or two weeks,"Grasslands, forests, swamps, mountains, and more",Omnivore,,,cricket,2400,,,,BrownRedBlackGreen,Exoskeleton,3.5 mph,a few months,200-800mg,0.2-2in,6-8 weeks,,Up to 100 eggs per day,"Spiders, reptiles, frogs, birds, small mammals, and insects",insect,,,,,Asia,Central-America,Eurasia,,,,,,,,,,,,,,,Europe,,,North-America,Oceania,South-America,,,
Crocodile,Animalia,Chordata,Reptilia,Crocodilia,Crocodylidae,Crocodylus,Crocodylus acutus,Africa,"Fish, crustaceans, deer, buffalo",Hatchling,Social,Unknown,Habitat loss and hunting,Eyes and nostrils located on top of the head and snout,"American crocodile, Orinoco crocodile, Freshwater crocodile, Philippine crocodile, Mexican crocodile, Nile crocodile, New Guinea crocodile, Mugger crocodile, Estuarine crocodile, Cuban crocodile, Siamese crocodile, Dwarf crocodile, Slender-snouted crocodile",,"Rivers, lakes, marshes, lagoons, mangrove swamps and estuaries",Carnivore,,Nocturnal,"Crocodile, Croc",13,"North, Central and South America, Africa, Asia, Australia",Have changed little in 200 million years!,Reptile,BrownGreyBlackDull Olive,Plate-like scales,25 mph,20 - 70 years,"18kg - 1,000kg (40lbs - 2,200lbs)",1.7m - 7m (5.5ft - 23ft),4 - 12 years,,,"Humans, Large felines, Birds of prey",,,,,,Asia,Central-America,North-America,,3 months,,,,,,,1 - 2 years,,,,,,Oceania,,,South-America,,,,,
Cross Fox,Animalia,Chordata,Mammalia,Carnivora,Canidae,Vulpes,Vulpes vulpes,North-America,"Birds, small mammals, insects, spiders, worms, reptiles","Cub, pup, kit",Solitary,Tens of thousands,"Humans, wolves, coyotes, mountain lions, eagles, bears",The cross on its back.,,49 to 55 days,"Forests, prairies, deserts, mountains, cities, suburbs, tundra, scrub, near rivers, farms",Carnivore,,,cross fox,,North America and Canada,,,RedBlackSilver,Fur,31 mph,"10 to 15 years in captivity, seven years in the wild",,"18 to 35 inches with 12 to 22 inch long tails, males a bit larger",10 months,56 to 70 days,5-13 cubs,"Gray wolves, coyotes, eagles, bears, humans and cougars",mammal,14 to 20 inches,,,,,,,,,,,,,,,,,,,,,,,,,,,,,
Cross River Gorilla,Animalia,Chordata,Mammalia,Primates,Hominidae,Gorilla,Gorilla gorilla diehli,Africa,,,,,,,,,Rainforest and dense jungle,Herbivore,1,Troop,,,,Less than 300 remaining!,,GreyBlack,Hair,25 mph,35 - 50 years,100kg - 200kg (220lbs - 440lbs),,,,,"Human, Leopard, Crocodile",Mammal,1.4m - 1.7m (4.7ft - 5.5ft),,,,,,,,,,,,,"Leaves, Fruit, Flowers",,,,,,Leaves,,,,,,,,,,
Crow,Animalia,Chordata,Aves,Passeriformes,Corvidae,Corvus,,Africa,"Insects, fruit, carrion",,,27 million,Pet trade,Caw,American crow,,"Fields, orchards, savannas, suburbs",Omnivore,,,Crow,,,,,Black,Feathers,59 mph,4-20 years,11-21 ounces,16-20 inches,,,3-7 eggs,"Coyotes, bobcats",Bird,6-10 inches,,,,Asia,Central-America,Eurasia,36 inches,18 days,,,,,,,,,"Trees, shrubs, telephone poles",,,,Europe,1,,North-America,Oceania,South-America,,,
Crucian Carp,Animalia,Chordata,Actinopterygii,Cypriniformes,Cyprinidae,Carassius,Carassius carassius,Asia,"water fleas, organic detritus, algae, zooplankton, aquatic weeds, small crustaceans, insects, larvae, fish eggs, small fish and small animals living in the lake, pond or river mud",,School,Abundant,genetic invasion by Prussian carp and goldfish,,"English carp, golden carp, gibele and Prussian carp",2-3 days,"lakes, ponds, slow-moving rivers",Omnivore,,,Crucian carp,1,,,,GoldGreen,Scales,2.7 mph,Up to 10 years,4.4lbs to 6.6lbs,6in to 2.1ft (64cm),,,,"Bass, European catfish, European smelt, blue tilapia, snakes, northern pike, Little egret",Cyprinidae - carp,,"Looks like a big, golden-green goldfish",,,Eurasia,Europe,,,,,,,,,,,,,,,,,1,6.5-9.0,,,,,,
Cuban Cockroach,Animalia,Arthropoda,Insecta,Blattodea,Blaberidae,Panchlora,Panchlora nivea,Central-America,none,nymphs,Group,Unknown,"Humans, birds, rats",light green color,green banana cockroach,48 days,"Trees, shrubs, and other damp/dark places in tropical environments",Omnivore,,,"Cuban cockroach, green banana cockroach",1,"Cuba, the Caribbean, southern United States coast",,Group,YellowGreen,Exoskeleton,4 mph,,,,,,28-60 eggs,"birds, rats",Insect,,,,,,,,,,,,,,,,,,,,,,,,,,,,,,
Cuckoo,Animalia,Chordata,Aves,Cuculiformes,Cuculidae,Cuculus,Cuculidae,Africa,insects,,,between 25 and 100 million birds,Shifting habitat,"Feet, which are zygodactyl (two inner toes face forward, two outer twos face backward)",,,"Forests, meadows, woodlands, and scrub areas.",Omnivore,"12 and 22 eggs each breeding season, spread among different nests.",,cuckoo,127,Every continent except Antarctica,,,,,19 mph,six years,.5 ounces to 1.4 ounces,,,,,"Raptors (adult birds), Snakes and raccoons (nestlings)",bird,,,,,Asia,Central-America,Eurasia,"Up to 42 inches for the largest species, the channel-billed cuckoo",11 to 13 days,,,,,,,,,"Trees, bushes, the ground. Some species lay their eggs in other bird's nests.",,,,Europe,,,North-America,Oceania,South-America,,,
Curly Coated Retriever,Animalia,Chordata,Mammalia,Carnivora,Canidae,Canis,Canis lupus,Europe,,,,,,,,,,Omnivore,,,Curly Coated Retriever,,,A lively and fun-loving breed!,Gun Dog,BrownBlack,Hair,,14 years,95 lbs,,,,,,,,,,,,,,,,,,,,,,,,,,,,,,,,,,,,
Cuscus,Animalia,Chordata,Mammalia,Marsupialia,Phalangeridae,Phalanger,Phalanger maculatus,Asia,,,,,,,,,Tropical rainforest and mangroves,Herbivore,2,Solitary,,,,"Has a long, strong prehensile tail!",,BrownGreyBlackWhiteTanCream,Fur,15 mph,8 - 12 years,3kg - 6kg (6.5lbs - 13lbs),15cm - 60cm (6in - 24in),,,,"Snakes, Humans, Large birds of prey",Mammal,,Long tail and strong toes,,,Oceania,,,,,,,,,"Fruit, Leaves, Insects",,,,,,Fruit,,,,,,,,,,
Cuttlefish,Animalia,Mollusca,Cephalopoda,Decapodiformes,Sepiida,,Sepiida,Ocean,,,,,,,,,Coastal and deeper waters,Carnivore,200,,Cuttlefish,120,Worldwide,Found throughout the world's oceans!,,BrownYellowRedBlueWhiteGreenOrangePink,Smooth,,,3kg - 10.5kg (6.6lbs - 23lbs),15cm - 50cm (5.9in - 20in),,,,"Fish, Sharks, Cuttlefish",,,Long body shape and large eyes,,,,,,,,,,,,"Crab, Shrimp, Fish",,,,,,Crab,,,,,,,,,,
Czechoslovakian Wolfdog,Animalia,Chordata,Mammalia,Carnivora,Canidae,Canis,Canis lupus,Europe,,puppy,,,,"upright, triangle ears",,,,Omnivore,,,,,,,,GreySilver,Hair,62 mph,10-15 years,,,,,6-7 puppies,,mammal,,,"Intelligent, athletic, and loyal",,,,,,,,,,,,,,,,,,Czechoslovakia and Slovakia,,,,,,,,,
Dachsador,Animalia,Chordata,Mammalia,Carnivora,Canidae,Canis,Canis lupus,North-America,,,,,,,,,,Omnivore,,,,,,,,YellowBlackChocolate,Hair,,12-15 years,40 lbs,,,,,,,,,"Friendly, affectionate, and playful",,,,,,,,,,,,,,,,,,,,,,,,,,,
Dachshund,Animalia,Chordata,Mammalia,Carnivora,Canidae,Canis,Canis lupus,Europe,,,,,,,,,,Omnivore,,,Dachshund,,,Fun and playful breed of small dog!,Hound,RedBlackTanCreamChocolate,Hair,,15 years,32 lbs,,,,,,,,,Stubborn but playful and devoted,,,,,,,,,,,,,,,,,,,,,,,,,,,
Dalmadoodle,Animalia,Chordata,Mammalia,Carnivora,Canidae,Canis,Canis lupus,North-America,,,,,,,,,,Omnivore,,,,,,,,,,,,,,,,,,,,,,,,,,,,,,,,,,,,,,,,,,,,,,,,
Dalmador,Animalia,Chordata,Mammalia,Carnivora,Canidae,Canis,Canis lupus,North-America,,,,,,,,,,Omnivore,,,,,,,,,,,,,,,,,,,,,,,,,,,,,,,,,,,,,,,,,,,,,,,,
Dalmatian,Animalia,Chordata,Mammalia,Carnivora,Canidae,Canis,Canis lupus,Europe,,,,,,,,,,Omnivore,,,Dalmation,,,Have an energetic and playful nature!,Gun Dog,BlackWhiteLight-Brown,Hair,,13 years,60 lbs,,,,,,,,,Sensitive and energetic,,,,,,,,,,,,,,,,,,,,,,,,,,,
Danios,Animalia,Chordata,Actinopterygii,Cypriniformes,Cyprinidae,Danio,Danio rerio,Asia,"small insects, worms",,School,,loss of habitat,Stripes down the side of most species,Zebra fish,1.5-2 days,"streams, ponds",Omnivore,,,Danios,27,,,,BlackWhite,Scales,,Up to 5 years,,,,,,Larger fish and amphibians,,,,,,,,,,,,,,,,Fresh,,,,,,,,,7.0-7.8,,,,,,
Dapple Dachshund,Animalia,Chordata,Mammalia,Carnivora,Canidae,Canis,Canis lupus,Europe,,,,,,,,,,Omnivore,,,,,,,,RedBlueBlackTanCreamSilverChocolate,Hair,,12 to 16 years,16 to 32 pounds (standards); 11 pounds or less (miniature),,,,,,,,,"Friendly, courageous, independent",,,,,,,,,,,,,,,,,,,,,,,,,,,
Darwin’s fox,Animalia,Chordata,Mammalia,Carnivora,Canidae,Lycalopex,Lycalopex fulvipes,South-America,"Small mammals, reptiles, insects and other invertebrates","Pup, cub, kit",Solitary,"639 adults, conservation status endangered","Habitat fragmentation, feral and domesticated dogs",Its small size,"Darwin's zorro, zorro chilote, zorro de Darwin",Perhaps two months,"Temperate rainforests, shrubland",Omnivore,,,,1,Chile,,,GreyRedBlack,Fur,45 mph,Seven years,4 to 8.7 pounds,20.79 inches,About one year,About two months,Two to three,,Mammal,,,,,,,,,,,,,,,,,,,,,,,,,,,,,,
Darwin’s Frog,Animalia,Chordata,Amphibia,Anura,Rhinodermatidae,Rhinoderma,Rhinoderma Darwinii,South-America,,,,,,,,,Beech-tree forests and in fields,Carnivore,,Solitary,,,,Camouflages itself as a dead leaf!,,BrownGreyBlackTanGreen,Permeable,5 mph,10 - 15 years,2g - 5g (0.07oz - 0.17oz),2.5cm - 3.5cm (0.9in - 1.4in),,,,"Rodents, Snakes, Birds",Amphibian,,Small body size and leaf-like appearance,,,,,,,,,30,,,"Insects, Worms, Snails",,,,,,Insects,,,,,,,,,,
Death Adder,Animalia,Chordata,Reptilia,Squamata,Elapidae,Acanthopis,Acanthopis antarcticus,Oceania,"Birds, small mammals",,,,,,,,,Omnivore,3-30+,,Death Adder,,,,,BrownRedBlack,,,Up to 15 years,,,,,,,,,"Black, brown and red bands",,,,,,,,,,,,,,,,,,,,,,,,,,,,
Death’s Head Cockroach,Animalia,Arthropoda,Insecta,Blattodae,Blaberidae,Blaberus,Blaberus craniifer,Central-America,insects,Nymphs,Gregarious,Millions,"birds, reptiles",Skull shaped mark on its carapace,True Death’s Head Cockroach,3 - 4 weeks,"Woods, forests, jungles",Omnivore,,,Death’s Head Cockroach,,,,Gregarious,BrownBlack,Hard Outer Shell,,1 year,less than 1 ounce,more than 2 inches,4 - 5 months,,34 eggs,"Birds, reptiles, spiders",Insect,,,,,North-America,,,,,,,,,,,,,,,,,,,,,,,,,
Deathwatch Beetle,Animalia,Arthropoda,Insecta,Coleoptera,Ptinidae,Xestobium,Xestobium rufovillosum,Africa,,Larvae,Solitary,Unknown,None,The mottled brown shell,Woodworm,A month,Anywhere with wood,Herbivore,,,Deathwatch Beetle,1,Europe and North America,,,BrownBlackWhite,Exoskeleton,,2-10 years,1-5mg,5-9mm (0.2-0.4in),2-10 years,,40-80 eggs,"Mammals, birds, spiders, and other insects",Insect,,,,,Europe,North-America,Oceania,,,,,,,,,,,,,Wood,,,,,,,,,,
Deer,Animalia,Chordata,Mammalia,Artiodactyla,Cervidae,,Odocoileus virginiana,Asia,,,,,,,,,Dense forest and planted areas,Herbivore,1,Herd,,,,There are around 40 different species!,,BrownWhiteTanOrange,Fur,43 mph,10 - 20 years,10kg - 450kg (22lbs - 990lbs),,,,,,Mammal,60cm - 105cm (24in - 206in),Long ears and some male species have antlers,,,Eurasia,Europe,North-America,,,,,,,"Acorns, Fruit, Grass",,,,,,Acorns,,,,,,,,,,
Deer Head Chihuahua,Animalia,Chordata,Mammalia,Carnivora,Canidae,Canis,Canis lupus,Central-America,,,,,,,,,,Omnivore,,,,,,,,GreyFawnBlackWhiteSilver,Hair,,15 to 20 years,12 lbs,,,,,,,,,"Charming, intelligent, and friendly",,,,,,,,,,,,,,,,,,,,,,,,,,,
