Rock Crab,Animalia,Arthropoda,Malacostraca,Decapoda,Cancridae,Cancer,Cancer productus,Ocean,,,Solitary,,Predators and commercial fishing.,large brown-black claws with lighter-colored tips,,6-8 weeks,"Near rocks, tide pools, and rocky marine areas.",Omnivore,,,red rock crab,1,,,,Red,Shell,,Up to 8 years,Approximately 13 ounces,,,,,"Sand and kelp bass, other fish, seabirds, and sea otters.",Decapod,Approximately 4 inches,,,,,,,,,,,,,,,,,,,"Worms, clams, mussels, other crabs, other invertebrates, and algae.",,,,,,,,,,
Rock Hyrax,Animalia,Chordata,Mammalia,Hyracoidea,Procaviidae,Procavia,Procavia capensis,Africa,"Grasses, Fruits, Lizards",Pup,Colony,Sustainable,Habitat loss,Rubbery soles of their feet,"Rock Dassie, Rock Rabbit",8 months,Dry savanna and rainforest,Omnivore,2,Diurnal,Rock Hyrax,2,eastern to southern Africa,Actually related to Elephants and Manatees!,Mammal,BrownGreyYellowWhiteTan,Fur,18 mph,5 - 12 years,3kg - 4kg (6.6lbs - 8.8lbs),45cm - 55cm (17.7in - 21.6in),16 - 17 months,4 months,,"Leopards, Large Birds, Snakes",,,,,,Asia,,,,,,,,,,,,,,,,,,,,,,,,,
Rock Python,Animalia,Chordata,Reptilia,Squamata,Pythonidae,Python,Python sebae,Africa,"Mammals, including warthogs and antelopes and bats, lizards, crocodiles, fish, the cubs of big cats and the pups of wild dogs, pet dogs, pet cats and livestock",,,,,,,,,Carnivore,,,"Rock python, African rock python",,,,,YellowDull OliveGrey-Brown,Scales,,18 to 30 years,,9 feet 10 inches to over 25 feet,,,20 to 100,,reptile,,,,,,,,,,,,,,,,,,,,,,,,,,,,,,
Rockfish,Animalia,Chordata,Actinopterygii,Scorpaeniformes,,,,Ocean,"Shrimp, crab, and greenlings",,School,More than 400 million fishes,,Vibrant colors,,Can be several days to several months,"Bering Sea, North Pacific, and the Aleutian Islands",Omnivore,,,Rockfish,100,,,,YellowRedBlackGreenOrange,Scales,,Up to 120 years,770 grams to 5.3 Kgs,"8 to 40 inches, up to three feet",,,,"Harbor seals, salmonids, and lingcod",Fish,,,,,,,,,,,,,,,Salt,,,,,"Shrimp, crab, and greenlings",,,,,,,,,,
Rockhopper Penguin,Animalia,Chordata,Aves,Sphenisciformes,Spheniscidae,Eudyptes,Eudyptes chrysocome,Antarctica,,,,,,,,,Rocky Antarctic Islands,Carnivore,2,Colony,,,,There are 3 different species!,,GreyBlackWhite,Feathers,,15 - 20 years,2kg - 5kg (4.4lbs - 11lbs),,,,,"Leopard Seal, Killer Whale, Sharks",Bird,45cm - 58cm (18in - 23in),"Red beaks and eyes, with yellow head feathers",,,Ocean,Oceania,South-America,,,,,,,"Krill, Fish, Shrimp",,,,,,Krill,,,,,,,,,,
Rodents,Animalia,Chordata,Mammalia,Rodentia,,,,Africa,"Small invertebrates, small mammals, birds, fish","Pups, pinkies, kittens",Social,"Billions, though some rodents are endangered.","Humans, habitat destruction, climate change",The ever-growing incisors that define them.,"Sewellel (mountain beaver); groundpig, whistlepig (groundhog); chigüiro, fercho (capybara); street rat, sewer rat, wharf rat (brown rat); votsotsa (Malagasy giant rat); coypu (nutria); fat dormouse (edible dormouse); cavy (guinea pig); sand puppy (naked mole-rat).",16 days (hamster) to 205 to 217 days (North American porcupine),Every type of habitat but Antarctica,Omnivore,,,"Rats, mice, porcupines, guinea pigs, capybaras, hamsters, gerbils, squirrels, etc.",2277,Worldwide,,Horde,BrownGreyBlackWhite,Fur,22 mph,Six months (Muller’s Giant Sunda Rat) to 32 years (naked mole rat),0.11 ounces (pygmy jerboa) to 146 pounds (capybara),2 inches (pygmy jerboa) to 4.4 feet (capybara),5 weeks (house mouse) to 18 months (capybara),3 weeks (house mouse) to 3 months (capybara),"Two (capybara, which only breeds once a year) to 14 (brown rat, which can breed seven times a year).","Cats, birds of prey, jaguars, snakes, caimans, humans, dogs, lizards",Rodent,Up to 20 to 24 inches high at the shoulder (capybara),,,,Asia,Central-America,Eurasia,,,,,,,,,,,,,,,Europe,,,North-America,Oceania,South-America,,,
Roe Deer,Animalia,Chordata,Mammalia,Artiodactyla,Cervidae,Capreolus,Capreolus capreolus,Asia,,Fawn,Herd,15 million mature individuals,Habitat loss and hunting,The male’s prominent antlers,"The western roe deer, European roe, or roebuck",Up to 10 months,"Forests, grasslands, and meadows",Herbivore,,,Roe Deer,1,Europe and Western Asia,,,BrownBlackWhite,Hair,37 mph,10-15 years,22-30kg (48-66lbs),105-120cm (3.5-4ft),14-36 months,4-5 months,1-3 fawns,"Wolves, lynxes, and foxes",Mammal,95-135cm (3-4.4ft),,,,Eurasia,Europe,,,,,,,,,,,,,,"Grass, leaves, berries, and buds",,,,,,,,,,
Rooster,Animalia,Chordata,Aves,Galliformes,Phaisianidae,Gallus,Gallus domesticus,Africa,Insects,Chick,Sociable,23 billion,"Humans, predators",Bushy tailfeathers,"Cock, cockerel, capon",21 days,Farms,Omnivore,,,Rooster,1,Worldwide,,Flock,BrownRedBlueBlackWhiteGreen,Feathers,9 mph,8 to 15 years,,10 to 16 inches,16 to 26 weeks,2 months,2 to 4,"Foxes, coyotes, raccoons",Bird,2 to 3 feet tall,,,,Asia,Central-America,Eurasia,,,,,,,,,,,,,,,Europe,,,North-America,Oceania,South-America,,,
Rose-breasted Grosbeak,Animalia,Chordata,Aves,Passeriformes,Carinalidae,Pheucticus,Pheucticus ludovicianus,Central-America,Insects,,,4.1 million,"Predators, collisions",The male’s red breast,Cut-throat,,"Woods, swamps, near rivers, second growth forests, marshes, pastures, roadsides",Omnivore,,,Rose-breasted grosbeak,1,"North America, Central America, northern South America, the Caribbean",,,BrownRedBlackWhitePale Rose,Feathers,,"7.3 in the wild, 24 in captivity",1.5 to 1.6 ounce,7 to 9 inches,,,One to five,,Bird,,,,,North-America,South-America,,11 to 13 inches,11 to 14 days,,,,,,Saltwater,,,"Trees, vines, shrubs",10 days,,,,1,,,,,,,
Roseate Spoonbill,Animalia,Chordata,Aves,Ciconiiformes,Threskiornithidae,Ajaja,Ajaja ajaja,Central-America,"Minnows, Shrimp, Insects",Chick,Flock,Sustainable,Water pollution,"A long, spatula-shaped bill",,,Shallow wetlands and mangrove swamps,Omnivore,,Diurnal,Roseate Spoonbill,1,"Gulf Coast, Central and South America",The only Spoonbill in the western hemisphere!,Bird,RedBlackWhitePink,Feathers,,10 - 15 years,1.2kg - 1.8kg (2.6lbs - 4lbs),,3 - 4 years,,,"Alligators, Coyotes, Humans",,60cm - 80cm (23.6in - 31.4in),,,,North-America,South-America,,110cm - 130cm (43in - 51in),3 weeks,1 month,3,,,,,,,,,,,,,,,,,,,
Rottsky,Animalia,Chordata,Mammalia,Carnivora,Canidae,Canis,Canis lupus,North-America,,,,,,,,,,Omnivore,,,,,,,,BrownGreyBlackWhiteTanCream,Hair,,8 to 14 years,95lbs,,,,,,,,,"Loyal, protective, affectionate",,,,,,,,,,,,,,,,,,,,,,,,,,,
Rottweiler,Animalia,Chordata,Mammalia,Carnivora,Canidae,Canis,Canis lupus,Europe,,,,,,,,,,Carnivore,,,Rottweiler,,,"Strong, loyal and self-assured!",Working,BlackTan,Hair,,12 years,132lbs,,,,,,,,,"Loyal, affectionate, calm, quiet, sensitive and protective",,,,,,,,,,,,,,,,,,,,,,,,,,,
Rough Green Snake,Animalia,Chordata,Reptilia,Squamata,Colubridae,Opheodrys,Opheodrys aestivus,North-America,"Insects, snails, spiders, and small frogs",,,,,,Grass snake and green grass snake,,,Carnivore,,,rough green snake,,,,,Green,Scales,,Up to 8 years,,2.5 – 3 feet,,,3-12 eggs,,reptile,,,,,,,,,,,,,,,,,,,,,,,,,,,,,,
Royal Penguin,Animalia,Chordata,Aves,Sphenisciformes,Spheniscidae,Eudyptes,Eudyptes schlegeli,Antarctica,,,,,,,,,Rocky Antarctic Islands,Carnivore,2,Colony,,,,Can reach speeds of 20mph!,,GreyYellowBlackWhite,Feathers,,15 - 20 years,3kg - 6kg (6.6lbs - 13lbs),,,,,"Leopard Seal, Killer Whale, Sharks",Bird,60cm - 68cm (24in - 27in),Orange beak with yellow feathers on head,,,Ocean,,,,,,,,,"Krill, Fish, Shrimp",,,,,,Krill,,,,,,,,,,
Rubber Boa,Animalia,Chordata,Reptilia,Squamata,Boidae,Charina,Charina bottae,," Lizards, rodents",,,,,,,,,Omnivore,1-5 babies,,Rubber boa,,,,,BrownYellow,,,12-25 years,,14-33 inches,,,,,,,,,,,,,,,,,,,,,,,,,,,,,,,,,"Solid brown, yellow belly with brown spots",,
Ruby-Throated Hummingbird,Animalia,Chordata,Aves,Apodiformes,Trochilidae,Archilochus,Archilochus colubris,Central-America,"Dragonflies, birds, snakes",,,7 million,Habitat loss,Male’s ruby-red throat,Eastern hummingbird,,Open woodlands,Herbivore,,,Hummingbird,1,Eastern United States and Caribbean,,,GreyWhiteGreen,Feathers,40 mph,3-5 years,0.11 ounces,2.3 - 3.5 inches,,,2,"Hawks, owls, crows, roadrunners",Bird,3.5 inches,,,,North-America,,,4 – 4.75 inches,11-16 days,,,,,,,,,Tree or large shrub,12 months,Nectar,,,1,,,,,,,
Ruddy Turnstone,Animalia,Chordata,Aves,Charadriiformes,Scolopacidae,Arenaria,Arenaria interpres,Africa,"Insects, crustaceans, seeds, fish",,,"300,000-500,000",Disease,"Brown, orange, black feathers",Turnstone,,"Coastlines, wetlands, grasslands",Omnivore,,,Turnstone,2,Worldwide,,,BrownBlackWhite,,,9-19 years,3 oz -5.3 oz,8-9 inches,,,02-May,"American mink, Arctic fox, red fox, rats",Bird,,,,,Europe,North-America,South-America,20-22 inches,22-24 days,,,,,,,,,Rocky ground,,,,,1,,,,,,,
Russell Terrier,Animalia,Chordata,Mammalia,Carnivora,Canidae,Canis,Canis lupus,Europe,,,,,,,,,,Omnivore,,,,,,,,BrownBlackWhiteTan,Hair,,13 – 16 years,,,,,,,,,,"Curious, alert, and friendly",,,,,,,,,,,,,,,,,,,,,,,,,,,
Russian Bear Dog,Animalia,Chordata,Mammalia,Carnivora,Canidae,Canis,Canis lupus,Eurasia,,,,,,,,,,Omnivore,,,,,,,,BrownGreyBlackCream,Hair,,10 to 12 years,170 pounds,,,,,,,23 to 30 inches,,Bold and Fearless,,,,,,,,,,,,,,,,,,,,,,,,,,,
Russian Blue,Animalia,Chordata,Mammalia,Carnivora,Felidae,Felis,Felis catus,Eurasia,,,,,,,"Archangel Cat, Archangel Blue",,,Omnivore,6,,Russian Blue,,,First brought to the UK in the 1800s!,Shorthair,SilverLight GreyDark Grey,Hair,,15-20 years,"males 10-12 pounds, females 7-10 pounds",,,,,,,,,"Independent, easy-going and loyal",,,,,,,,,,,,,,,,,,,,,,,,,,,
Russian Tortoise,Animalia,Chordata,Reptilia,Testudines,Testudinidae,Agrionemys,Agrionemys horsfieldii,Asia,,hatchlings,Semi-social,,Humans,Spiked tail,"Central Asian Tortoise, Afghan Tortoise, Steppe Tortoise",56-84 days,arid steppes,Herbivore,,,Russian Tortoise,,Central Asia,,Social but territorial,BrownYellowBlackTanGreen,Hard Outer Shell,5 mph,"80 years, 40 years in captivity",0.5-2.5 lbs,5-10 in.,10 yrs,,five eggs,"Raccoon, fox, coyote",reptile,3-4 in.,,,,Eurasia,,,,,,,,,,,,,,,"grasses, flowers, leaves and other vegetation",,,,,,,,,,
Saanen Goat,Animalia,Chordata,Mammalia,Artiodactyla,Bovidae,Capra,Capra aegagrus hircus,Europe,grass and legume,kid or billy,,"9,00,000",,white skin and short white coat,"Saanenziege, Chèvre de Gessenay, and Capra di Saanen",,cool weather and hilly terrain,Omnivore,2,HerdFlock,saanen goat,8,,,herd,WhiteCream,Hair,,about 10 years,,,9 months,12 months,,"Coyotes, bobcats, wild dogs, and wolves",mammal,30 inches,,calm,,,,,,,,,,,,,,,,,,Switzerland,,,,,,,,,
Saarloos Wolfdog,Animalia,Chordata,Mammalia,Carnivora,Canidae,Canis,Canis lupus,Europe,,,,,,,,,,Omnivore,,,,,,,,,Hair,,,,,,,,,,,,,,,,,,,,,,,,,,,,,,,,,,,,,,,
Saber-Toothed Tiger,Animalia,Chordata,Mammalia,Carnivora,Felidae,Smilodon,Smilodon populator,Central-America,,,,,,,,,Forests and grasslands,Carnivore,3,Pack,,,,Canines up to 7 inches long!,,BrownYellowBlackWhiteTan,Fur,,20 - 40 years,300kg (661lbs),2m - 2.5m (79in - 98in),,,,Humans,Mammal,,Large muscular body and long canine teeth,,,North-America,South-America,,,,,,,,"Deer, Bison, Woolly Mammoth",,,,,,Deer,,,,,,,,,,
Sable,Animalia,Chordata,Mammalia,Carnivora,Mustelidae,Martes,Martes zibellina,Asia,"Molluscs, hares, rodents, musk deer",Cub,Solitary,2.3 million,Poaching,Luxurious fur,,245 to 298 days,Dense forest,Omnivore,,,Sable,,"Russia, Mongolia, parts of China and Korean Peninsula",,Solitary,BrownBlack,Fur,,18 to 22 years,2 to 4 pounds,35 to 36 centimeters,2 years,7 weeks,1 to 7,"Wolves, foxes, wolverines, tigers, lynxes, eagles, owls",Mammal,,,,,Eurasia,,,,,,,,,,,,,,,,,,,,,,,,,
Sable Black German Shepherd,Animalia,Chordata,Mammalia,Carnivora,Canidae,Canis,Canis lupus,Europe,,Puppy,,,,,,,,Omnivore,,,,,,,,GreyRedBlackTanSilver,Hair,30 mph,9-13 years,,,,,5-9 puppies,,mammal,,,"Intelligent, loyal, and courageous",,,,,,,,,,,,,,,,,,Germany,,,,,,,,,
Sable Ferret,Animalia,Chordata,Mammalia,Carnivora,Mustelidae,Mustela,Mustela furo,Africa,Rabbits and vermin if it is used for ferreting,Kit,Gregarious,Millions. The conservation status is “domesticated.”,None,"Its beautiful, dark brown fur",Poley,42 days,"Among humans, though native habitats are forests and woods near water.",Carnivore,,,Sable Ferret,1,Cosmopolitan,,Gregarious,BrownWhiteGoldCream,Fur,15 mph,Six to 10 years,0.66 to 5.95 pounds,"20 inches including the tail, males larger than females",6 months,Three to six weeks,As many as 15 kits,None,Mammal,,,,,Asia,Central-America,Eurasia,,,,,,,,,,,,,Meat in the form of ferret food,,Europe,,,North-America,Oceania,South-America,,,
Saiga,Animalia,Chordata,Mammalia,Artiodactyla,Bovidae,Saiga,Saiga tatarica,Asia,,calves,Herd,"50,000-150,000",poaching,Large nose with downward-facing nostrils,,5 months,"arid grasslands, steppes",Herbivore,,Herd,Saiga,2,Central Asia,,,BrownGreyYellow,Hair,80 mph,10-12yrs,30-45kg (66-99lbs),1-1.5m (3.2-5ft),8 months to 2 years,4 months,01-Feb,"wolves, dogs, foxes, humans",Antelope,0.6-0.8m (2-2.5 ft),,,,,,,,,,,,,,,,,,,"grasses, lichen",,,,,,,,,,
Saint Berdoodle,Animalia,,,,,,,,,,,,,,,,,Omnivore,,,,,,,,,,,,,,,,,,,,,,,,,,,,,,,,,,,,,,,,,,,,,,,,
Saint Bernard,Animalia,Chordata,Mammalia,Carnivora,Canidae,Canis,Canis lupus,Europe,,,,,,,,,,Omnivore,,,Saint Bernard,,,"Gentle, loyal and friendly!",Mastiff,BrownYellowRedWhiteBrindleWhite-BrownMulti-colored,Hair,,10 years,91kg (200lbs),,,,,,,,,"Intelligent, friendly, loyal",,,,,,,,,,,,,,,,,,,,,,,,,,,
Saint Shepherd,Animalia,Chordata,Mammalia,Carnivora,Canidae,Canis,Canis lupus,North-America,,,,,,,,,,Omnivore,,,,,,,,BrownBlackWhite,Hair,,10 to 14 years,150 lbs,,,,,,,,,"Friendly, intelligent, eager-to-please",,,,,,,,,,,,,,,,,,,,,,,,,,,
Salamander,Animalia,Chordata,Amphibia,Caudata,Salamandroidea,,Caudata,Asia,,,,,,,,,"Rainforest, streams and wetlands",Carnivore,300,Solitary,,,,There are more than 700 different species!,,BrownYellowRedBlackWhiteGreen,Permeable Scales,30 mph,5-20 years,0.1-65kg (0.2-143lbs),,,,,"Fish, Snakes, Birds",Amphibian,,,,,Central-America,Eurasia,Europe,,,,,,,"Fish, Mice, Insects",,,,,,Fish,,North-America,,,South-America,,,,,
Salmon,Animalia,Chordata,Actinopterygii,Salmoniformes,Salmonidae,,Salmonidae,North-America,"Worms, squid, crustaceans, and other fish",,Solitary,Millions,Habitat change,The physical transformation in spawning season,,,"Open seas, lakes, or streams",Carnivore,,,Salmon,8,,,,BrownRedBlueGreenPurpleSilver,Scales,,Up to 7 years,23 lbs,58 inches,,,,"Bears, seals, killer whales, sharks, otters, kingfishers, eagles, and humans",Ray-finned fish,,,,,Ocean,South-America,,,,,,,,,Salt,,,,,,,,,,,,,,,
Salmon Shark,Animalia,Chordata,Chondrichthyes,Lamniformes,Lamnidae,Lamna,Lamna ditropis,Ocean,fish,,Solitary,unknown,humans,"short snout, two keels",Pacific Porbeagle,9 months,"marine, ocean",Carnivore,,,Salmon Shark,1,,,,GreyWhite,Plate-like scales,50 mph,20-27 years,210lbs-660lbs,1.8m - 3m (6ft - 10ft),,,,"humans, other sharks",fish,,,,,,,,,,,,,,,Salt,,,,,,,,,,,,,,,
Saluki,Animalia,Chordata,Mammalia,Carnivora,Canidae,Canis,Canis lupus,Asia,,Puppy,,,,,,,,Omnivore,,,,,,,,FawnRedWhiteGoldTanCream,Hair,43 mph,10-17 years,,,,,4-8 puppies,,,,,,,Europe,,,,,,,,,,,,,,,,Fertile Crescent,,,,,,,,,
Sambar,Animalia,Chordata,Mammalia,Artiodactyla,Cervidae,Rusa,Rusa unicolor,Asia,,Fawn,Solitary/Group,Unknown,Habitat loss and hunting,The large antlers of the male,Sambhur or sambur,8-9 months,Forests and grasslands,Herbivore,,,Sambar,1,South Asia,,,BrownWhite,Fur,,26 years,"109-544kg (240-1,200lbs)",1.5-2.4m (5-8ft),2 years,,1-2 fawns,"Humans, tigers, leopards, and dholes",Mammal,1.2-1.5m (4-5ft),,,,North-America,Oceania,,,,,,,,,,,,,,"Leaves, berries, grasses, bark, fruits, herbs, and buds",,,,,,,,,,
Samoyed,Animalia,Chordata,Mammalia,Carnivora,Canidae,Canis,Canis lupus,Not Listed,,,,,,,,,,Omnivore,,,Samoyed,,,,,WhiteCreamBeige,Hair,,12 to 14 years,,,,,,,,,,"Gentle, friendly, adaptable",,,,,,,,,,,,,,,,,,,,,,,,,,,
Sand Crab,Animalia,Arthropoda,Malacostraca,Decapoda,,,,Africa,Plankton and dinoflagellates,Larvae,Solitary,Unknown,Habitat loss,The heavy armored shell,Mole crab and sand flea,3-4 months,Beaches and dunes,Omnivore,,,Sand Crab,,Worldwide,,,BrownGrey,Exoskeleton,,2-3 years,Less than 1kg (2lbs),2-5cm (0.75-2in),1-2 years,,"Up to 45,000 eggs",Fishes and birds,Crustacean,,,,,Asia,Central-America,Eurasia,,,,,,,,,,,,,,,Europe,,,North-America,Oceania,South-America,,,
Sand Lizard,Animalia,Chordata,Reptilia,Squamata,Lacertidae,Lacerta,Lacerta agilis,Asia,,,,,,,,,Grass and heathland,Carnivore,,Solitary,,,,Males turn green in spring!,,BrownBlackTanGreen,Scales,30 mph,5 - 8 years,10g - 15g (0.35oz - 0.5oz),13cm - 20cm (5in - 7.8in),,,,,Reptile,,Striped patterned body and forked tongue,,,Eurasia,Europe,,,,,8,,,"Spiders, Insects, Grasshoppers",,,,,,Spiders,,,,,,,,,,
Sand Tiger Shark,Animalia,Chordata,Chondrichthyes,Lamniformes,Odontaspididae,,,Ocean,"Bony fish, other sharks, crustaceans, squid, skates and rays",,Solitary/Group,"Unknown, but its population decreased by 20 percent in just the last decade due to overfishing.",Humans,It gulps air to keep buoyant.,"spotted ragged-tooth shark, blue-nurse sand tiger, grey nurse shark, spotted sand tiger shark, chien de mer, dogfish shark, slender-tooth shark, magonga, requin taureau, ground shark",Eight to twelve months,Shallow tropical and temperate waters close to the shore,Carnivore,,,Sand tiger shark,4,,,,Grey-Brown,Rough,0.87 mph,13 to 35 years,110 to 660.79 pounds,6.6 to 10.5 feet,,,,,Fish,,,,,,,,,,,,,,,,,,,,,,,,,,,,,,
Sand Viper,Animalia,Chordata,Reptilia,Squamata,Viperidae,Cerastes,Cersates viperus,Africa,"lizards, geckos, small mammals",,,,,,"Saharan Sand Viper, Common Sand Viper",,,Carnivore,,,sand viper,,,,,Tan,Scales,,15 - 18 years,,12 - 20 inches,,,up to eight live young,,reptile,,,,,Asia,,,,,,,,,,,,,,,,,,,,,,,,,
Saola,Animalia,Chordata,Mammalia,Artiodactyla,Bovidae,Pseudoryx,Pseudoryx nghetinhensis,Asia,"Leaves, Grasses, Herbs",Calf,Mainly solitary,less than 250,Habitat loss and hunting,Horns that can grow up to 50cm long,Asian Unicorn,8 months,Moist and dense evergreen forest,Herbivore,1,Diurnal,Saola,1,Mountains of Vietnam-Laos border,Only known to science since 1992!,Mammal,BrownRedBlack,Fur,23 mph,8 - 12 years,80kg - 100kg (176lbs - 220lbs),150cm - 200cm (59in - 77in),2 - 3 years,6 - 8 months,,"Human, Tiger, Crocodile",,,,,,,,,,,,,,,,,,,,,,,,,,,,,,,
Sardines,Animalia,Chordata,Actinopterygii,Clupeiformes,Clupeidae,,,Ocean,,,School,"Pacific Sardine population is measured at 27,547 metric tons",Overfishing as a food source,Silver color and one small dorsal fin,"Pilchard, Sardina",Eggs hatch in three days,Saltwater oceans and seas around the world,Omnivore,,,"European Pilchard, Pacific Sardine, South American Pilchard",21,,,,Silver,Scales,,Up to 13 years,3 ounces to 7 pounds,6 to 12 inches,,,,"Dolphins, seals, penguins, sharks, terns, pelicans",Ray-finned fish (Actinopterygii),,,,,,,,,,,,,,Zooplankton and Phytoplankton,Salt,,,,,,,,,,,,,,,
Satanic leaf-tailed gecko,Animalia,Chordata,Reptilia,Squamata,Gekkonidae,Uroplatus,Uroplatus phantasticus,Africa,Insects and small invertebrates,Hatchling,Solitary,"Unknown, conservation status is Least Concern","Habitat loss, illegal pet trade",Its amazing camouflage,"Eyelash leaf-tailed gecko, phantastic leaf-tailed gecko",90 to 120 days,Tropical forests,Carnivore,,,Satanic Leaf-tailed Gecko,1,Madagascar,,,BrownTanOrangePurple,Scales,,,"0.14 to 0.32 ounces, females heavier","3.5 inches, plus tail",Five to six months,,Two to three per clutch,"Snakes and rats, perhaps birds",Reptile,,,,,,,,,,,,,,,,,,,,,,,,,,,,,,
Savanna Goat,Animalia,Chordata,Mammalia,Artiodactyla,Bovidae,Capra,Capra hircus,Africa,,Kid,Flock,"3,000 in the U.S., South Africa unknown",,Solid white coat with black skin,,150 days,savanna mixed woodland-grassland,Herbivore,,,savanna goat,-1,"South Africa, South America, United States, New Zealand, Australia",,,BlackWhite,Hair,,15-18 years,132 pounds,,4-6 months,10 to 12 weeks,1-3 kids,"humans, foxes, wolves, coyotes, mountain lions, bobcats, bears, eagles, dogs",Mammal,1.64ft - 2.08ft,,,,North-America,Oceania,South-America,,,,,,,,,,,,,,,,,,,,,,,
Savannah Sparrow,Animalia,Chordata,Aves,Passeriformes,Passerellidae,Passerculus,Passerculus sandwichensis,Central-America,"Flies, caterpillars, beetles",Chicks,,"17,00,00,000",Environmental loss and ingesting insecticide,A yellow stripe over its eyes,,,"Open fields, prairies, meadows, and salt marshes",Omnivore,,Flock,Savannah Sparrow,,,,,BrownGreyYellowWhiteTan,Feathers,,2 - 6 years,.53 - 1 oz.,4 - 7 inches,,,,"Snakes, cats, and hawks",,,Its breast is white with dark streaks,,,North-America,,,,10 - 13 days,3 weeks,,,,,,Approximately 21 days,,On the ground beneath decaying vegetable matter,,,,,,,,,,,,
Sawfish,Animalia,Chordata,Chondrichthyes,Rhinopristiformes,Pristidae,,,Ocean,fish and crustaceans,,Solitary,,Poaching,Ridged rostrum,Carpenter sharks,12 months,Coastal,Carnivore,,,Sawfish,5,,,,BrownGrey,Scales,,30 years,"500 - 1,300 lbs",18 - 25 ft,,,,"Crocodiles, sharks, and dolphins",rhinopristoform,,,,,,,,,,,,,,,Salt,,,,,,,,,,,,,,,
Scarlet Kingsnake,Animalia,Chordata,Reptilia,Squamata,Colubridae,Lampropeltis,Lampropeltis triangulum elapsoides,North-America,"Lizards, other snakes, birds and their eggs, rodents",,,,,,scarlet milk snake,,,Carnivore,,,scarlet kingsnake,,,,,YellowRedBlackWhite,Scales,,21 years,,1.5 to 2.5 feet,,,10,,reptile,,,,,,,,,,,,,,,,,,,,,,,,,,,,,,
Scarlet Macaw,Animalia,Chordata,Aves,Psittaciformes,Psittacidae,Ara,Ara macao,Central-America,,,,"20,000 - 50,000",Habitat destruction,Brightly colored plumage,,,Rainforests,Omnivore,,,Scarlet macaw,1,Central and South America,,,YellowRedBlue,Feathers,35 mph,Up to 75 years,2lbs,30-35in,,,,"Jaguars, eagles, hawks, monkeys, and snakes",Bird,,,,,South-America,,,3ft,3-4 weeks,,,,,,,,,Upper canopy,3-4 months,"Fruit, nuts, nectar, and insects",,,,,,,,,,
Schipperke,Animalia,Chordata,Mammalia,Carnivora,Canidae,Canis,Canis lupus,Europe,,,,,,,,,,Omnivore,,,,,,,,FawnBlueBlackTanCreamChocolate,Hair,,12 to 14 years,16 lbs,,,,,,,,,Confident and lively,,,,,,,,,,,,,,,,,,,,,,,,,,,
Schneagle,Animalia,Chordata,Mammalia,Carnivora,Canidae,Canis,Canis lupus,North-America,,,,,,,,,,Omnivore,,,,,,,,BlackWhiteTan,Hair,,12-15 years,25 lbs,,,,,,,,,"Alert and energetic, but devoted",,,,,,,,,,,,,,,,,,,,,,,,,,,
Schnoodle,Animalia,,,,,,,,,,,,,,,,,Omnivore,,,,,,,,,,,,,,,,,,,,,,,,,,,,,,,,,,,,,,,,,,,,,,,,
Scimitar-horned Oryx,Animalia,Chordata,Mammalia,Artiodactlya,Bovidae,Oryx,Oryx Dammah,Africa,N/A,,,,"Human hunting, loss of habitat",,,,Desert and savanna woodlands,Herbivore,,Diurnalnomadic,Scimitar-horned oryx,,Norther Africa,Believed to be the inspiration for unicorn myths!,Mammal,,,MPH mph,15-20 years,200 to 460 lbs,,,,,"Lions, leopards, golden jackals, hyenas",,,,,,,,,,,,,,,,,,,,,,,,,,,,,,,
Scorpion,Animalia,Arthropoda,Arachnida,Scorpiones,Scorpionoidea,,Scorpiones,Africa,,,,,,,,,"Dry desert, grassland, savanna and tropical jungles",Carnivore,6,Solitary,,,,"There are around 2,000 known species!",,BrownYellowRedBlackWhite,Shell,12 mph,4-25 years,10-100g (0.4-3.5oz),,,,,,Arachnida,,,,,Asia,Central-America,Eurasia,,,,,,,"Insects, Spiders, Small rodents",,,,,,Insects,,Europe,,,North-America,Oceania,South-America,,,
Scorpion Fish,Animalia,Chordata,Actinopterygii,Scorpaeniformes,Scorpaenidae,,Scorpaenidae,Ocean,"Coral reef, snails, and small fishes",,Solitary,Not known,"Sharks, rays, and large snappers",Venom mucous covered sharp spines,,3 to 18 months,"Indian Ocean, Pacific Ocean, and Indonesia",Omnivore,,,Scorpionfish,198,,There are more than 200 recognised species!,,BrownYellowRedOrange,Scales,,15 years,3.4 pounds,8 inches to 20 inches,,,,"Sharks, snappers, and rays",Fish,,,,,,,,,,,6000,,,,Salt,,,,,"Coral reefs, small fishes, snails",,,,8.1 - 8.4,,,,,,
Scottish Terrier,Animalia,Chordata,Mammalia,Carnivora,Canidae,Canis,Canis lupus,Europe,,,,,,,,,,Omnivore,,,,,,,,BlackBrindleBeige,Hair,,12-15 years,22 lbs,,,,,,,,,"Confident, independent, and alert",,,,,,,,,,,,,,,,,,,,,,,,,,,
Scrotum Frog,Animalia,Chordata,Amphibia,Anura,Telmatobiidae,Telmatobius,Telmatobius culeus,South-America,"Snails, fish, tadpoles, amphipods, aquatic insects","Larva, tadpole",Solitary,As few as 45,"Hunting, invasive species, pollution, disease",its loose skin," Lake Titicaca frog, Titicaca water frog",one to two weeks,The Lake Titicaca basin,Carnivore,,,Scrotum frog,1,Peru and Bolivia,,solitary,BrownGreyGreen,Skin,,up to 15 years,nine ounces to two pounds,"As much as eight inches, with 16-inch hind legs",five years,,80 to 500,"trou, humans",amphibian,,,,,,,,,,,,,,,,,,,,,,,,,,,,,,
Sea Anemone,Animalia,Cnidaria,Anthozoa,Actiniaria,,,,Ocean,"Shrimp, small fish",,Solitary/Group,,,Colors,,,Oceans,Carnivore,,,Sea anemone,,,,,YellowRedBlueGreenOrangePurplePinkLilacPeachPale Rose,,,60–80 years,,,,,,"Sea turtles, sea slugs",,"1/2""–6'",,,,,,,,,,,,,,Salt,,,,,,,,,,,,,,,
Sea Dragon,Animalia,Chordata,Actinopterygii,Syngnathiformes,Syngnathidae,Phycodurus,Phycodurus eques,Ocean,,,,,,,,,Tropical coastal waters,Carnivore,,,Sea Dragon,,,Inhabits tropical coastal waters of Australia!,,BrownGreyYellowRedBlackWhiteTanGreenOrange,Scales,,2 - 10 years,,20cm - 24cm (10in - 12in),,,,Large Fish,,,Elongated snout and easily camouflaged body,,,Oceania,,,,,,250,,,"Plankton, Shrimp, Small fish",Salt,,,,,Plankton,,,,6.5 - 8.0,,,,,,
Sea Eagle,Animalia,Chordata,Aves,Accipitriformes,Accipitridae,Haliaeetus Savigny,Haliaeetus,Africa,"Fish, rodents, small birds, reptiles, and amphibians",,,More than a million,"Habitat loss, poisoning, and hunting",The contrasting dark and light plumage,Fish eagles and erns,,"Next to rivers, lakes, and seas",Carnivore,,,sea eagle,10,everywhere except South America,,,BrownYellowBlackWhite,Feathers,98 mph,About 20 years on average,up to 20 pounds,,,,,,bird,Up to 3.3 feet,,,,Antarctica,Asia,Central-America,up to seven feet,one month,,2,,,,,,,trees and cliffs,two to three months,,,Eurasia,1,,Europe,North-America,Ocean,,Oceania,
