Irish WolfHound,Animalia,Chordata,Mammalia,Carnivora,Canidae,Canis,Canis Lupus,Europe,,,,,,,,,,Omnivore,,,Irish WolfHound,,,"Sweet-tempered, patient and thoughtful!",South,,Hair,,9 years,54kg (120lbs),,,,,,,,,,,,,,,,,,,,,,,,,,,,,,,,,,,,
Italian Greyhound,Animalia,Chordata,Mammalia,Carnivora,Canidae,Canis,Canis lupus,Europe,,,,,,,,,,Omnivore,,,Italian Greyhound,,,,,GreyYellowFawnRedBlueBlackTanChocolate,Hair,,15 years,,,,,,,,,,,,,,,,,,,,,,,,,,,,,,,,,,,,,
Ivory-billed woodpecker,Animalia,Chordata,Aves,Piciformes,Picidae,Campephilus,Campephilus principalis,Central-America,"Berries, nuts, seeds, and insects",,,Unknown,Deforestation,The ivory-colored bill,,,Forests and swamps,Omnivore,,,Ivory-Billed Woodpecker,1,United States and Cuba,,,RedBlackWhite,Feathers,,Around 20 years,450-570g,19-21 inches,,,,"Raccoons, snakes, owls, crows, and hawks",Bird,,,,,North-America,,,31in,2 weeks,,,,,,,,,Hollowed trees,5 weeks,,,,,,,,,,,
Jacana,Animalia,Chordata,Aves,Charadriiformes,Jacanidae,Jacana Brisson,Jacanidae,Africa,"Insects, snails, worms, crabs, fish, mollusks, and seeds",,,millions,habitat loss,The long legs and feet,Lilly trotters or lotus birds,,wetlands,Omnivore,,,jacana,8," Asia, Africa, Australia, and Central and South America",,,BrownYellowRedBlackWhiteGreen,,,,one to nine ounces,,,,,"Otters, turtles, crocodiles, snakes, birds of prey, and fish",bird,six to 12 inches,,,,Asia,Central-America,Oceania,20 inches,22-28 days,,3,,,,,,,floating islands,50-60 days,,,South-America,,,,,,,,
Jack Russell,Animalia,Chordata,Mammalia,Carnivora,Canidae,Canis,Canis lupus,Europe,,,,,,,,,,Omnivore,,,Jack Russel,,,"Intelligent, athletic and fearless!",Terrier,,Hair,,12 - 14 years,15 pounds,,,,,,,,,,,,,,,,,,,,,,,,,,,,,,,,,,,,
Jackabee,Animalia,Chordata,Mammalia,Carnivora,Canidae,Canis,Canis lupus,North-America,,,,,,,,,,Omnivore,,,,,,,,BrownWhiteTanCreamBeige,Hair,,12-16 years,30 lbs,,,,,,,,,"Friendly, intelligent, and hard-working",,,,,,,,,,,,,,,,,,,,,,,,,,,
Jackal,Animalia,Chordata,Mammalia,Carnivora,Canidae,Canis,Canis Aureus,Africa,,,,,,,,,Grass plains and dry woodland,Carnivore,5,Pack,,,,Can maintain speeds of 16 km/h!,,BrownGreyWhiteTan,Fur,20 mph,8-15 years,6.8-11kg (15-24lbs),,,,,"Hyena, Leopard, Eagles",Mammal,,,,,Asia,Europe,,,,,,,,"Antelope, Reptiles, Insects",,,,,,Antelope,,,,,,,,,,
Jackdaw,Animalia,Chordata,Aves,Passeriformes,Corvidae,,,Asia,"Seeds, fruits, insects, spiders, snails, carrion, and bird eggs",,,Around 100 million,Predators,The silvery white plumage around the neck,"Jackerdaw, sea crow, cawdaw, caddy",,"Farmlands, woodlands, cliffs, and urban environments",Omnivore,,,Jackdaw,1,Eurasia,,,GreyBlackWhitePurpleSilver,Feathers,25 mph,5 years on average,8 ounces,,,,,"Birds of prey, stoats, weasels, polecats, cats, and rodents",Bird,13 inches,,,,Eurasia,Europe,,27in,17-18 days,,,,,,,,,Hollow cavities,A month,,,,1,,,,,,,
Jackrabbit,Animalia,Chordata,Mammalia,Lagomorpha,Leporidae,Lepus,Lepus californicus,Central-America,"Grass, twigs, bark",Leveret,Solitary,,Habitat loss,Long ears,hare,41-47 days,"Desert, savanna, grassland",Herbivore,,,Black-tailed jackrabbit,6,"United States, Mexico",,solitary,BrownBlackWhite,Fur,45 mph,five to eight years,three to six pounds,up to two feet,243 days,14 to 21 days,one to six,"coyotes, red-tailed hawks, bobcats",mammal,,,,,North-America,,,,,,,,,,,,,,,,,,,,,,,,,
Jackson’s Chameleon,Animalia,Chordata,Reptilia,Squamata,Chamaeleonidae,Trioceros,Trioceros jacksonii,Africa,"Insects, centipedes, isopods, millipedes, spiders, lizards, birds, and snails.",Hatchlings,Solitary,,Natural predators and adult chameleons,Three horns,Trioceros,5-6 months,"Woodlands, forests",Carnivore,,,"Jackson’s chameleon, Jackson's horned chameleon, three-horned chameleon, or Kikuyu three-horned chameleon",3,"Hawaii, South-Central Africa",,,YellowBlueGreen,Scales,,5-10 years,90 to 150 grams,9 to 13 inches,5 months,,8-30 eggs,"Carnivorous spiders, birds, snakes, monkeys, shrews, and parasites.",Reptile,,,,,North-America,,,,,,,,,,,,,,,,,,,,,,,,,
Jaguar,Animalia,Chordata,Mammalia,Carnivora,Felidae,Panthera,Panthera onca,Central-America,"Deer, Capybara, Tapir",Cub,Solitary,"15,000",Hunting and habitat loss,Beautiful rosetted fur pattern,,90 - 105 days,"Rainforest, swamp and floodplains",Carnivore,3,Crepuscular,Jaguar,1,Central and South America,The largest feline on the American continent!,Mammal,BrownYellowBlackWhiteTan,Fur,50 mph,12 - 15 years,36kg - 160kg (79lbs - 350lbs),1.1m - 1.9m (43in - 75in),3 - 4 years,3 months,,,,,,,,South-America,,,,,,,,,,,,,,,,,,,,,,,,,
Jaguarundi Cat,Animalia,Chordata,Mammalia,Carnivora,Felidae,Herpailurus,Herpailurus yagouaroundi,Central-America,"Rabbits, frogs, fish, mice",Kitten,Solitary,,Hunting,Light amber colored eyes,Otter cat and weasel cat,70-75 days,"Woodland, swamp, savannah, scrubland",Carnivore,,,Jaguarundi,8,Central and South America,,Solitary,BrownGreyRed,Hair,40 mph,15 years,,3-4 feet (head to end of tail),2 years,6 weeks,01-Apr,"Coyote, mountain lion, humans",Mammal,"10-14 inches, shoulder height",,,,South-America,,,,,,,,,,,,,,,,,,,,,,,,,
Japanese Beetle,Animalia,Arthropoda,Insecta,Coleoptera,Scarabaeidae,Popillia,Popillia japonica,Asia,,Larvae or grubs,Swarm,Millions (unknown population),Natural predators and insecticide.,Metallic green and copper body.,,1-2 weeks (from laying eggs to hatching),"Forests, grasslands, farms, cities, and anywhere they can eat.",Herbivore,,,Japanese beetle,1,"Native to Asia, but also found in Canada and United States",,Large groups and swarms,GreenGolden,Exoskeleton,,Approximately 1 year (varies by temperature),0.0825 grams,15 mm,2 weeks after hatching,,1-5 eggs,"Wild birds, raccoons, moles, spiders, other insects.",Insect,,,,,Europe,North-America,,,,,,,,,,,,,,Plant life and fruits,,,,,,,,,,
Japanese Chin,Animalia,Chordata,Mammalia,Carnivora,Canidae,Canis,Canis lupus,Asia,,,,,,,,,,Omnivore,,,Japanese Chin,,,"Alert, intelligent and independent!",Herd,,Hair,,14 years,4kg (8lbs),,,,,,,,,,,,,,,,,,,,,,,,,,,,,,,,,,,,
Japanese Macaque,Animalia,Chordata,Mammalia,Primates,Cercopithecidae,Macaca,Macaca fuscata,Asia,"Fruit, Young Leaves, Seeds",Infant,Troop,"50,000",Habitat loss,"Red and human-like, naked face",Snow Monkey,5 - 6 months,Tropical forest and mountains,Omnivore,1,Diurnal,Japanese Macaque,2,Throughout Japan,Has cheek pouches for storing food!,Mammal,BrownGrey,Fur,,25 - 32 years,5kg - 14kg (11lbs - 31lbs),,4 - 5 years,20 months,,"Human, Wolf, Feral Dog",,80cm - 95cm (31.5in - 37.5in),,,,,,,,,,,,,,,,,,,,,,,,,,,,,
Japanese Spitz,Animalia,Chordata,Mammalia,Carnivora,Canidae,Canis,Canis lupus,Asia,,,,,,Pure white coat with a mane-like neck.,,,,Omnivore,,,,,,,,White,Hair,,10-16 years,10-25 pounds,,,,,,,12-15 inches,,"Charming, playful, affectionate, and loyal.",,,,,,,,,,,,,,,,,,,,,,,,,,,
Japanese Squirrel,Animalia,Chordata,Mammalia,Rodentia,Sciuridae,Sciurus,Sciurus lis,Asia,,Kits,Solitary,Unknown,Habitat loss,"The big, bushy tail",,40 days,Mixed forests,Omnivore,,,Japanese Squirrel,1,Japan,,,BrownGreyRedWhite,Hair,,Up to 15 years,250-310g (9-11oz),"16-22cm (6-8.5in) in body length, not including the tail",300 days,60 days,2-6 kits,"Foxes, martens, crows, raptors, and domesticated cats and dogs",Mammal,Up to 15cm (6in),,,,,,,,,,,,,,,,,,,"Seeds, buds, fruits, fungi, flowers, and insects",,,,,,,,,,
Japanese Terrier,Animalia,Chordata,Mammalia,Carnivora,Canidae,Canis,Canis lupus,Asia,,,,,,,,,,Omnivore,,,,,,,,BlackWhiteTan,Hair,,12-15 years,10 lbs,,,,,,,,,"Loving, affectionate, cheerful",,,,,,,,,,,,,,,,,,,,,,,,,,,
Javan Rhinoceros,Animalia,Chordata,Mammalia,Perissodactyla,Rhinocerotidae,Rhinoceros,Rhinoceros Sondaicus,Asia,,,,,,,,,"Tropical bushland, grassland and rainforest",Herbivore,1,Solitary,,,,Only has a 25cm long horn!,,BrownGreyBlack,Leather,30 mph,30-45 years,"900kg - 2,300kg (2,000lbs - 5,100lbs)",3.1m- 3.2m (10ft - 10.5ft),,,,"Human, Wild cats",Mammal,,,,,,,,,,,,,,"Grass, Fruit, Berries, Leaves",,,,,,Grass,,,,,,,,,,
Javanese,Animalia,Chordata,Mammalia,Carnivora,Felidae,Felis,Felis catus,North-America,,,,,,,,,,Omnivore,7,,Javanese,,,Features that closely resemble a Siamese cat!,Longhair,BrownFawnRedBlueWhiteCreamLilac,Hair,,8-12 years,5-9 pounds,,,,,,,,,"Loving, gentle and affectionate",,,,,,,,,,,,,,,,,,,,,,,,,,,
Jellyfish,Animalia,Cnidaria,Scyphozoa,Semaeostomeae,Cyaneidae,,,Ocean,"Small fish, plants, fish eggs, larvae, other small marine creatures",,Group,"900 million, as of 1990","Sharks, birds, tuna, and sea anemone",Tentacles hanging from the body that help aid the jellyfish's stinging characteristics,,Hatches within one day,All oceans on planet earth,Carnivore,100,Group,Jellyfish,,,Have tentacles around their mouths!,,YellowRedBlueWhiteGreenOrangePurplePink,Smooth,5 mph,Three to Six months,20-400g (0.7-14oz),"0.5 inches to 16 inches, though they can grow to 7 feet",,,,"Sharks, birds, tuna, and sea anemone",Cnidaria,,,,,,,,,,,,,,,,,,,,"Small fish, plants, fish eggs, larvae, other small marine creatures",,,,,,,,,,
Jerboa,Animalia,Chordata,Mammalia,Rodentia,Dipodidae,,,Africa,,,,,,,,,Deserts and steppes,Omnivore,,Crepuscularterrestrial,,,Asia and Northern Africa,Tiny rodent with a kangaroo-like jump!,Mammal,,,,,0.8 to 1.3 ounces,,,,,"Owls, foxes, cats and snakes",,,,,,Asia,,,,,,,,,,,,,,,,,,,,,,,,,
Jonah Crab,Animalia,Arthropoda,Malacostraca,Decapoda,Cancridae,Cancer,Cancer borealis,North-America,"Mussels (especially blue mussels), arthropods, snails, and certain species of algae",,Solitary,Unknown,Unknown,Light spots and black-tipped claws,White leggers,9-14 days,"Rock, clay, sand, mud",Carnivore,,,Jonah crab,1,,,,,Shell,,1-5 years,12-19oz,,,,,"Seagulls, otters, alligators, sharks, rays, and bony fish, and humans",Crustacean,,Spotted color,,,,,,,,,,,,,Salt,,,,,,,,,,,,,,,
Joro Spider,Animalia,Arthropoda,Arachnida,Araneae,Araneidae,Trichonephila,Trichonephila clavata,Asia,Insects,Baby or spiderling,Group,,Humans,Extremely long legs with large abdomen,,2-4 months,Anywhere warm and humid,Carnivore,,,joro spider,1,"Southeast Asia, though it is an invasive species in some parts of the United States",,group,BrownYellowRedBlueBlack,Exoskeleton,,one year,,0.7-2.5 cm,2-3 months,Birth,400-500,Any mammals that eat spiders and other insects,Arachnid,,,,,,,,,,,,,,,,,,,,,,,,,,,,,,
Jumping Spider,Animalia,Arthropoda,Arachnida,Araneae,Salticidae,,,Africa,"Other spiders, insects, baby lizards",Spiderling,Solitary,billions,"Pesticides, climate change",Their large eyes,,Two to three weeks,"Tropical and temperate forests, intertidal zones, mountains, deserts, scrubland, fields, human habitation",Carnivore,,,Jumping spider,6000,"Africa, Asia, Europe, North America, Central America, South America",,,BrownGreyYellowRedBlueBlackWhiteTanGreen,,12.43 mph,six months to two years,,0.2 to 0.98 inches,"In the first spring and summer of life, or around the sixth to eighth molt",38 days in the case of Toxeus magnus,30 to 600,"Mantises, spider wasps, mammals, birds, lizards other spiders",arachnid,,,,,Asia,Central-America,Europe,,,,,,,,,,,,,,,North-America,,,South-America,,,,,
Junglefowl,Animalia,Chordata,Aves,Galliformes,Phasianidae,Gallus,,Asia,"worms, slugs, insects, mice, small lizards, and frogs",,,Unknown,Crossbreeding with domestic chickens,"Bright colors, red crest in males","Wild chicken, bankiva, bankiva fowl",,"Field edges, forests, scrubland, mountains, islands",Omnivore,,,Junglefowl,4,"South Asia, Southeast Asia",,,BrownYellowRedBlueBlackWhiteGoldPurple,Feathers,,"3-14 years in the wild, 10-30 years in captivity",24-51oz; female 17-40oz,"Male 26-30in, female 14-18in",,,,"Birds of prey, land-dwelling carnivorous animals","Phasanid, bird",,,,,,,,"Male 26-32in, female 14-25in",18-26 days,,,,,,,,,Underbrush,1 year,,,,,,,,,,,
Kai Ken,Animalia,Chordata,Mammalia,Carnivora,Canidae,Canis,Canis lupus,Asia,,,,,,Their brindle coat,Tiger dog,,,Omnivore,,,,,,,,GreyRedBlack,Hair,,14-16,25-45+ pounds,,,,,,,17-22 inches,,"Friendly, high-energy",,,,,,,,,,,,,,,,,,,,,,,,,,,
Kakapo,Animalia,Chordata,Aves,Psittaciformes,Nestoridae,Strigops,Strigops habroptilus,Oceania,,,,,,,,,Areas of natural vegetation and dense jungle,Herbivore,2,Solitary,,,,The heaviest species of parrot in the world!,,BrownGreen,Feathers,,50-65 years,2-4kg (4.5-9lbs),,,,,,Bird,,,,,,,,A few feet,30 days,,6,,,"Rimu fruit, Flowers, Roots, Seeds",,,,Hollow logs or crevices,3.5 months,Rimu fruit,,,,,,,,,,
Kangal,Animalia,Chordata,Mammalia,Carnivora,Canidae,Canis,Canis lupus,Europe,,,,,,,Anatolian Shepherd,,,Omnivore,,,,,,,,GreyFawnBlackGoldCream,Hair,,,,,,,5-10 puppies,,,,Dark muzzle and ears,"Loyal, protective, calm",,,,,,,,,,,,,,,,,,"Sivas, Turkey",,,,,,,,,
Kangaroo,Animalia,Chordata,Mammalia,Diprotodontia,Macropodidae,,,Oceania,,,,,,,,,"Dry forests, desert and grassland",Omnivore,2,Sociable,,,,Females have a deep pouch on their front!,,BrownGreyTan,Fur,35 mph,4-10 years,18-95kg (40-200lbs),,,,,"Human, Dingo",Mammal,,,,,,,,,,,,,,"Grass, Seeds, Flowers",,,,,,Grass,,,,,,,,,,
Kangaroo Rat,Animalia,Chordata,Mammalia,Rodentia,Heteromyidae,Dipodomys,,Central-America,Insects such as grasshoppers,"Pup, pinkie or kitten",Solitary,,Habitat destruction and fragmentation,Their powerful hind legs,"Rat kangaroo, desert rat",22 to 27 days,Desert,Omnivore,,,Kangaroo rat,22,Deserts,,,BrownWhiteDark Grey,Fur,5 mph,2 to 5 years though some giant kangaroo rats have been known to live for over 9 years,4.5 ounces,"As long as 14 inches, with an 8-inch tail and 6-inch body. Males are larger than females.",About 100 days,22 to 25 days,"One to seven babies, though the average litter contains three.",,,2 to 4 inches at the shoulder,,,,North-America,,,,,,,,,,,,,,,Seeds and grasses. Some species eat insects and other types of vegetation.,,,,,,,,,,
Keel-Billed Toucan,Animalia,Chordata,Aves,Piciformes,Ramphastidae,Ramphastos,Ramphastos sulfuratus,Central-America,,,,,,,,,Lowland rainforest and tropical forest borders,Omnivore,,Sociable,,,,It's beak can reach nearly 20 cm long!,,YellowRedBlackGreenOrange,Feathers,39 mph,15 - 20 years,2.1kg - 4kg (4.7lbs - 8.8lbs),,,,,"Human, Weasels, Large Birds",Bird,42cm - 55cm (17in - 22in),Small body and enormous colourful beak,,,South-America,,,109cm - 152cm (43in - 60in),16-20 days,,3,,,"Fruit, Eggs, Insects",,,,Tree cavities,8-9 weeks,Fruit,,,,,,,,,,
Keeshond,Animalia,Chordata,Mammalia,Carnivora,Canidae,Canis,Canis Lupus,Europe,,,,,,,,,,Omnivore,,,,,,,,,Fur,,13-15 years,34-45lbs,,,,,,,,,Alert & energetic,,,,,,,,,,,,,,,,,,,,,,,,,,,
Kenyan Sand Boa,Animalia,Chordata,Reptilia,Squamata,Boidae,Gongylophis,Gongylophis colubrinus,Africa,"Small mammals, lizards, birds",Snakelets,,Unknown,"Habitat destruction, over-collection for pet trade",Beautiful colorations,"East African sand boa, Egyptian sand boa, sand boa, Kenyan sand boa",4 months,"Semi-desert, scrubland, savannas, prefers loose soil",Carnivore,,Nocturnal,Kenyan sand boa,2,Northern and Eastern Africa,A popular pet snake that comes in dozens of morphs!,Reptiles,,,,,,,,,,,,,,,,Asia,,,,,,,,,,,,,,,,,,,,,,,,,
Kerry Blue Terrier,Animalia,Chordata,Mammalia,Carnivora,Canidae,Canis,Canis lupus,Europe,,,,,,,,,,Omnivore,,,,,,,,GreyBlueBlackSilver,Hair,,13 – 15 years,40 pounds,,,,,,,,,Smart and loyal,,,,,,,,,,,,,,,,,,,,,,,,,,,
Kestrel,Animalia,Chordata,Aves,Falconiformes,Falconidae,Falco,Falco sparverius,Africa,"Small rodents, lizards, insects, birds, and eggs",,,9.2 million,Starvation,Hunting behavior of hovering and diving,"Grasshopper hawk, killy hawk, short-winged hawk, windhover, house hawk, and rusty-crowned falcon",,Open countryside,Carnivore,03-Jul,,Sparrowhawk,15,"North America, most of South America, Europe, Asia, Africa",,,BrownBlack,,39 mph,"5 years in the wild, 17 years in captivity",2.8-6.5oz,8.7-15in,,,,"Larger birds of prey, snakes, fire ants, and cats",Bird,Unknown,,,,Asia,Europe,North-America,20-31in,30 days,,,,,,,,,"Natural cavities, other birds' nests, nesting boxes",The next spring (adults molt in the fall),,,South-America,1,,,,,,,
Keta Salmon,Animalia,Chordata,Actinopterygii,Salmoniformes,Salmonidae,Oncorhynchus,Oncorhynchus keta,Ocean,"Smaller fish, zooplankton, insects, comb jellies, squid, mollusks, tunicates",,School,in the millions,"Climate change, habitat loss or degradation",The blood red slash down the side of a breeding male,"Chum salmon, dog salmon, silverbrite salmon, white salmon, autumn salmon, damaha fish",3-4 months,"Oceans, estuaries, coastal streams",Carnivore,,,"Chum salmon, keta salmon",1,,,,BlueGreenSilverOlive,Scales,7 mph,3-5 years,,,,,,"Bears, humans, other fish, shorebirds, killer whales, sea lions, seals, stonefly larvae",fish,,,,,,,,,,,,,,,Brackish,,,,,,,,,,,,,,,
Key Deer,Animalia,Chordata,Mammalia,Artiodactyla,Cervidae,Odocoileus,Odocoileus virginianus,North-America,none,fawn,Solitary,700-800,vehicle collisions,small size,toy deer,7 months,"pine rocklands, woodlands, wetlands",Herbivore,,,key deer,1,Florida Keys,,herd,BrownWhiteGrey-Brown,Fur,26 mph,7-9 years,44-85 pounds,,6 months- 1.5 years,12-16 weeks,1,"Alligator, Crocodile",,24-32 inches,,,,,,,,,,,,,,,,,,,,,,,,,,,,,
Kiko Goat,Animalia,Chordata,Mammalia,Artiodactyla,Bovidae,Capra,Capra aegagrus Hircus,North-America,,kid,,,Humans,,,155 days,Farmland,Herbivore,,Herd,Kiko goat,1,"New Zealand, southeastern United States",,Herd,BrownBlackWhiteCream,Fur,,8-12 years,250-300 pounds,,12-18 months,60-90 days,2-3 kids (twins or triplets),"Coyotes, bears, bobcats, foxes, eagles, and mountain lions.",,26-37 inches,,"Friendly, docile, independent",,Oceania,,,,,,,,,,,,,,,"Grass, hay, and other natural foliage around habitat.",,,,,,,,,,
Killer Whale,Animalia,Chordata,Mammalia,Cetacea,Delphinidae,Orcinus,Orcinus orca,Ocean,,,Pod,,,,,,Ocean and coastal waters worldwide,Carnivore,1,Pod,,,,Typically consumes over 200 kg of food a day!,,BlackWhite,Smooth,30 mph,50-60 years,"6,804-8,618kg (15,000-19,000lbs)",,,,,"Human, Larger Sharks",Mammal,,,,,,,,,,,,,,"Seal, Fish, Squid",Salt,,,,,Seal,,,,,,,,,,
Kinder Goat,Animalia,Chordata,Mammalia,Artiodactyla,Bovidae,Capra,Capra aegagrus hircus,North-America,,Kid,Herd,3000,Predators,Black stripe on back,,140 to 150 days,"Farms, pastures",Herbivore,,,Kinder goat,1,"U.S., Canada and Brazil",,Ungulate,BrownGreyBlackWhite,Hair,,15 years,115 to 150lbs,,4 to 10 months,6 to 8 weeks,3 or more,,,2 to 3 feet,,,,South-America,,,,,,,,,,Saltwater,,,,,,,,,,,,,,,
King Cobra,Animalia,Chordata,Reptilia,Squamata,Elapidae,Ophiophagus,Ophiophagus hannah,Asia,"Lizards, birds, other snakes",Hatchlings,,Unknown,"Poaching, habitat loss",An expanding hood,hamadryad,66-105 days,"Forest, shrublands, wetlands",Carnivore,,Diurnal,King Cobra,20,South and southeast Asia,,Solitary,BrownYellowBlackGreen,Scales,12 mph,About 20 years,,,,,21 to 40 eggs,,Reptile,,,,,,,,,,,,,,,,,,,,,,,,,,,,,,
King Crab,Animalia,Arthropoda,Malacostraca,Decapoda,Lithodidae,Lopholithodes,Lopholithodes Mandtii,Ocean,,,,,,,,,Cold coastal waters and continental shelves,Carnivore,7,Solitary,,,,Can have a leg span of nearly 2 meters!,,RedBlueOrange,Shell,7 mph,15-30 years,2-8kg (4.4-18lbs),,,,,"Human, Larger Fish, Octopus",Crustacean,,,,,,,,,,,,,,"Molluscs, Fish, Sea Urchin",,,,,,Molluscs,,,,,,,,,,
King Penguin,Animalia,Chordata,Aves,Sphenisciformes,Spheniscidae,Aptenodytes,Aptenodytes patagonicus,Antarctica,,,,,,,,,Rocky Antarctic Islands,Carnivore,1,Colony,,,,More than 2 million breeding pairs!,,GreyYellowBlackWhite,Feathers,,15 - 20 years,11kg - 16kg (24lbs - 35lbs),,,,,"Leopard Seal, Killer Whale, Sharks",Bird,60cm - 90cm (24in - 35in),Large body size with yellow markings on head,,,Ocean,,,,,,,,,"Krill, Fish, Shrimp",,,,,,Krill,,,,,,,,,,
King Shepherd,Animalia,Chordata,Mammalia,Carnivora,Canidae,Canis,Canis lupus,North-America,,,,,,,,,,Omnivore,,,,,,,,BrownFawnRedBlack,Hair,,11 years,150 Lbs,,,,,,,,,Hard-working and loyal,,,,,,,,,,,,,,,,,,,,,,,,,,,
King Snake,Animalia,Chordata,Reptilia,Squamata,Colubridae,Lampropeltis,Lampropeltis elapsoides,North-America,,,,,,,,,,Carnivore,3-29 eggs,,Kingsnake,,,,,BrownYellowRedBlackWhite,,,10-15 years,,36-60 inches,,,,,,,,,,,,,,,,,,,,,,,,,,,,,,,,,,,
King Vulture,Animalia,Chordata,Aves,Accipitriformes,Cathartidae,Sarcoramphus,Sarcoramphus papa,Central-America,,,,"10,000",Habitat loss,,,,"Forests, savannas, and grasslands",Omnivore,,,King Vulture,1,Central and South America,,,GreyYellowRedBlackWhiteOrange,Feathers,,,,,,,,Cats and snakes,Bird,,,,,North-America,South-America,,1.8-2m (70-78in),50-60 days,,1,,,,,,,Hollow tree cavities,4-18 months,,,,,,,,,,,
Kingfisher,Animalia,Chordata,Aves,Coraciiformes,Alcedines,,,Africa,,,,,,,,,Lowland freshwater areas and river estuaries,Omnivore,,Solitary,,,,Inhabits wetlands and woodlands worldwide!,,BrownYellowRedBlueBlackGreenOrange,Feathers,25 mph,6 - 10 years,10g - 170g (0.4oz - 6oz),,,,,"Foxes, Snakes, Raccoons",Bird,10cm - 37.5cm (4in - 15in),"Small body and long, sharp and straight beaks",,,Asia,Central-America,Eurasia,Up to 2 feet,2 to 4 weeks,,4,,,"Fish, Shrimp, Insects, Tadpoles",,,,Burrows,3 to 8 weeks,Fish,,Europe,1,,North-America,Ocean,South-America,,,
Kinkajou,Animalia,Chordata,Mammalia,Carnivora,Procyonidae,Potos,Potos flavus,Central-America,,,Group,Deforestation,,"Long prehensile tail, which acts as a sort of third limb that can grip objects or branches.",,,,Omnivore,,,,,Central and South America,,,BrownGold,Fur,,23 years,3 to 10 pounds,"16 to 30 inches long, its tail adds another 15 to 22 inches",,,1,Humans,Mammal,,,,,South-America,,,,,,,,,"Fruit, small mammals or insects",,,,,,,,,,,,,,,,
Kirtland’s snake,Animalia,Chordata,Reptilia,Squamata,Colubridae,Clonophis,Clonophis kirtlandii,North-America,"Earthworms, slugs, small reptiles, and frogs",,,,,,,,,Carnivore,,,Kirtland’s Water Snake,,,,,BrownRedDark BrownOrangePink,Scales,,,,14-28 inches,,,,,,,,,,,,,,,,,,,,,,,,,,,,,,,,,,,
Kishu,Animalia,Chordata,Mammalia,Carnivora,Canidae,Canis,Canis lupus,Asia,,Puppy,,,,,Kishu-Ken and Kishu-Inu,,,Omnivore,,,Kishu,,,,,RedWhiteBrindle,Hair,,10-13 years,,,,,2-5 puppies,,Mammal,,,Loyal and earnest,,,,,,,,,,,,,,,,,,Japan,,,,,,,,,
Kit Fox,Animalia,Chordata,Mammalia,Carnivora,Canidae,Vulpes,Vulpes macrotis merriam,Central-America,"kangaroo rat, cottontail, jackrabbit, reptiles, insects, birds",pup,Solitary,,"habitat destruction, competition from coyotes",tiny bodies and enormous ears,,49 - 55 days,"desert, grasslands",Omnivore,,,kit fox,1,"Southwest United States, North and Central Mexico",,solitary,GreyYellowBlackWhite,Fur,25 mph,seven years in the wild. 12 years in captivity,4.5 to five pounds,"20 inches (body), 12 inches (tail)",10 months,eight weeks,one to seven pups,"coyotes, bobcats, red foxes, birds of prey",mammal,nine to 12 inches,,,,North-America,,,,,,,,,,,,,,,,,,,,,,,,,
Kiwi,Animalia,Chordata,Aves,Struthioniformes,Apterygidae,Apteryx,,Oceania,,,,,,,,,Forests and dense woodland,Omnivore,,Solitary,,,,Only found in the forests of New Zealand!,,BrownGreyWhite,Feathers,12 mph,8 - 12 years,1.3kg - 3.3kg (2.6lbs - 7.3lbs),,,,,"Foxes, Dogs, Cats",Bird,25cm - 45cm (9.8in - 17in),"Round body and long, sharp and straight beaks",,,,,,An inch per wing,75 to 85 days,,2,,,"Worms, Spiders, Insects, Fruit",,,,Burrows in the ground,Shortly after birth,Worms,,,,,,,,,,
Koala,Animalia,Chordata,Mammalia,Diprotodontia,Phascolarctidae,Phascolarctos,Phascolarctos cinereus,Oceania,Eucalyptus leaves,Joey,Solitary,Stable,Habitat loss and disease,"Large, wide head and tufted, round ears",Koala Bear,35 days,"Eucalyptus, inland and coastal forests",Herbivore,1,Nocturnal,Koala,3,south-eastern Australia,Spends up to 80% of the time sleeping or resting!,Mammal,GreyBlackWhiteGrey-Brown,Fur,2 mph,15 - 20 years,4kg - 15kg (8.8lbs - 33lbs),,2 years,6 - 7 months,,"Birds of Prey, Dingo, Human",,60cm - 85cm (24in - 34in),,,,,,,,,,,,,,,,,,,,,,,,,,,,,
Kodkod,Animalia,Chordata,Mammalia,Carnivora,Felidae,Leopardus,Leopardus guigna,South-America,"Rodents, birds, reptiles, and insects",Kittens,Solitary,"6,000-92,000 mature individuals",Habitat loss,The black spots and stripes all over the body,"Güiña, guigna, or Chilean cat",72-78 days,Mountain or coastal forests,Carnivore,,,Kodkod,1,Chile and Argentina,,,BrownBlackWhite,Fur,,11 years,2-2.5kg (4.4-5.5lbs.),40-52cm (15-20in),2 years,,1-4 kittens,,Mammal,25cm (10in),,,,,,,,,,,,,,,,,,,,,,,,,,,,,
Koi Fish,Animalia,Chordata,Actinopterygii,Cypriniformes,Cyprinidae,Cyprinus,"Cyprinus rubrofuscus ""koi""",Asia,"Aquatic insects and their larvae, crustaceans, worms, its own young",,School,"Hundreds of thousands, at least",None,Its beauty,"Nishikigoi, koi carp",Four to seven days,Private and public bodies of fresh water,Omnivore,,,Koi fish,1,,,,GreyYellowRedBlackWhiteGreenOrangeSilver,Scales,,25 to 200 years,35 pounds,39 inches,,,,"Wading birds such as herons, small mammalian carnivores",Fish,,,,,,,,,,,,,,,Fresh,,,,,,,,,7.0 to 8.5,,,,,,
Komodo Dragon,Animalia,Chordata,Reptilia,Squamata,Varanidae,Varanus,Varanus komodoensis,Asia,"Pigs, Deer, Water Buffalo",Pup,Solitary,"3,000 - 5,000",Hunting and habitat loss,Long and deep forked tongue to taste the air,Komodo Monitor,,Open woodland and hillsides,Carnivore,20,Diurnal,Komodo Dragon,1,Komodo National Park,Only found on five Indonesian islands,Reptile,BrownGreyCream,Scales,11 mph,25 - 40 years,70kg - 150kg (150lbs - 300lbs),2m - 3.1m (6.6ft - 10.3ft),5 years,,,,,,,,,,,,,8 -9 months,,,,,,,On hatching,,,,,,,,,,,,,,
Kooikerhondje,Animalia,Chordata,Mammalia,Carnivora,Canidae,Canis,Canis lupus,Europe,,,,,,,,,,Omnivore,,,,,,,,RedWhite,Hair,,12 to 14 years.,24 pounds,,,,,,,,,"Affable, alert, cheerful",,,,,,,,,,,,,,,,,,,,,,,,,,,
